text,bias
"Activist Dorian Wilde said anti-LGBT statements from officials cause stigma and discrimination towards the community, and transgender people in particular have to bear the brunt of the hatred due to their visibility.",0
"U.S. President Donald Trump retweeted a video showing one of his supporters in Florida shouting “white power” at protesters of his administration, drawing rebukes from allies and adversaries as protests continue in the aftermath of George Floyd’s death.",1
"Everything in the progressive agenda is aimed at dismantling nationhood, hence the creation of strains of victimhood according to gender and ethnicity.",1
"Even pro-life leaders have expressed their approval of using vaccines produced with fetal cell lines, in cases with no alternative.",0
"Backlash against marginalized communities doesn’t surprise University of Southern California Professor Chris Freeman, whose work primarily focuses on 20th century gay and lesbian studies.",0
"The U.S. debate over restrictions for fighting the coronavirus intensified on Monday, as protesters labeled mandatory lockdowns as “tyranny,” while medical workers and health experts cautioned that lifting them too soon risked unleashing a greater disaster.",0
"Andreyah Garland, a 44-year-old single mother of three daughters, bought a shotgun in May for protection in the quaint middle-class town of Fishkill, New York. ",1
The Europeans have set up a complicated barter-type system to skirt direct financial transactions with Iran and so evade possible U.S. sanctions.,1
"Shortly before President Trump signed phase one of the historic trade deal with China, a Chinese pastor described the fear and intimidation believers are enduring under the Communist government.",0
"As a political calculation, it shows Biden’s campaign is confident about their standing with many suburban moderates who were swing voters in the past but have moved solidly into the Democratic Party during Trump’s presidency, offended by his bullying demeanor and chaotic style.",1
"Yet MLB, with an exhaustive 100+ page health and safety operations manual, will attempt to become the first major sport to return on July 23 with two nationally televised games, and the rest of the teams scheduled to start July 24.\",0
"The new “wealth tax” is not out of character for Warren, who has long railed against income inequality and the uber-rich, but would mark a move to the left by the party as a whole if it were adopted.",0
"Over 70,000 women in Germany have been subjected to female genital mutilation (FGM), and a further 17,000 young girls are at risk of having the barbaric procedure being committed against them.",1
"Using the same alarmist language he has employed to describe illegal immigration, Trump painted Democrat-led cities as out of control and lashed out at the “radical left,” which he blamed for rising violence in some cities, even though criminal justice experts say it defies easy explanation.",1
"Cuban slave doctors that have escaped the system have said that, while working abroad, the Castro regime forced them to invent patients and throw away perfectly good medicine to boost the statistics on the number of patients Cuban doctors actually treat.",1
"Should China be the first country to develop an effective vaccine, dictator Xi Jinping has promised to provide the world with “free” coronavirus vaccines paid for by Beijing. ",1
"The right to abortion is just that — the right to kill unborn humans. But pro-abortionists like Quinn and Cuomo find it easier to argue that they are fighting for “reproductive rights” (even though pro-lifers are not objecting to any woman’s right to reproduce) or that fetuses are not humans but “clumps of cells.” Just as with slave owners and eugenicists before them, it’s easier for pro-abortionists to advocate for murder after they’ve dehumanized the lives they want to end.",1
"Biden has promised to prohibit the sale of military-style rifles and high-capacity magazines, similar to a 10-year ban that expired in 2004.",0
"If your “rights” mean taking everyone else’s rights away, that is not “peaceful protest.” And to compare mob behavior to the civil rights movement is to dishonor its legacy.",1
"At any other time, the U.S. would have led efforts and coordinated global fights against epidemics, but the science-averse Trump administration had already axed the CDC expert in China.",1
"While Americans still cling to sexist gender roles at home, overwhelming majorities believe that sex discrimination in public spaces should be illegal.",1
An avowed white supremacist pleaded guilty on Monday for planning bomb and shooting attacks at a synagogue and LGBTQ bar in Las Vegas. ,0
Trump's comments came during a mega-rally in the world's largest cricket stadium — part of an elaborate Indian welcome for a president who revels in pomp and pageantry.,1
"Tuesday’s nominating contests in New York, Kentucky and four other states featured progressives challenging older, establishment Democrats at a time of a national reckoning with racial injustice following the May 25 death of George Floyd, an unarmed Black man, while in Minneapolis police custody.",0
"As the deadly COVID-19 contagion sweeps across the country, gun sales are surging, spurred in many regions by panic buying and purchases by first-time firearm owners. ",1
"Still, the CDC has withdrawn tracking numbers about testing from its website, fueling the belief that the White House is still playing politics with health information.",1
"Despite an estimate showing that China — the world's biggest polluter — emitted 25 percent less carbon than in the same four-week period the previous year, Shuo remains skeptical about any lasting changes.",1
Lawmakers specifically said they want to protect women from facing unfair competition from men who claim to be transgender women.,1
"New York City parents and those across America where these evil restrictions are reemerging have to remember, and have to punish at the polls the politicians who steal this from our kids.",1
"Polling throughout the Democratic primary showed Sanders triumphing with young voters by massive margins, and early polling in the general election has shown Biden running weaker with younger voters than past Democratic nominees.",0
"Middle-class exodus: From 2007 to 2016, California lost a net million residents — some 2.5% of its population (which still grows due to births and immigration). ",1
"With this in mind, the Trump administration reportedly hopes to reduce poverty in the United States, not by making a material difference in struggling families’ finances, but by tinkering with the threshold for what counts as poverty.",1
"Dexter Faircloth stalked the streets of Houston’s Third Ward, the historic Black neighborhood where he was born and raised, shouting greetings and asking an urgent question.",0
"In office, however, Trump has continued the GOP crusade against Medicaid. ",1
The battle of Portland is just plain crazy — but what else would you expect in Donald Trump’s dystopian America?,1
"Even prior to Trump formally announcing Barrett as his nominee, leftists launched a string of attacks, targeting her faith, family, and conservative positions.",1
"After Steve King’s offensive implication that white people own Western civilization, Chris Hayes predictably responded with an idiotic remark about Western civilization giving us Hitler.",1
"Republicans could try again to repeal Obamacare if they win enough seats in U.S. elections next month, Senate Republican Leader Mitch McConnell said on Wednesday, calling a failed 2017 push to repeal the healthcare law a “disappointment.”",0
Republican Senator Rand Paul on Friday called on the FBI to investigate a crowd of protesters that swarmed him as he departed the White House after listening to U.S. President Donald Trump accept his party’s nomination for re-election.,0
"It wasn’t President Donald Trump’s escalating demands that the U.S. central bank lower interest rates, or Kaplan’s view of the U.S. economy that attendees at the lunch in Corpus Christi wanted most to know about. ",0
"Reuters photographer Dylan Martinez heard the words ring out during chaotic scenes in London on Saturday, when mostly peaceful anti-racist demonstrations turned into violent scuffles with counter-protesters in the area.",1
"Alphabet Inc.’s Google, the world’s largest online advertising platform, blocked advertising from finance blog ZeroHedge.com last week because of what it deemed hateful comments from users posted to the website’s articles.",0
"In reality, the Trump administration implemented Operation Warp Speed, which created a public-private partnership to fast-track a coronavirus vaccine.",0
"She is one of Donald Trump's natural heirs, even using his patented lies and happy-talk approach to the virus, telling lawmakers recently that ""in South Dakota, we didn't take a one-size-fits-all approach and the results have been incredible.""",1
The astute observer will note that China is not exactly eager to take in large numbers of migrants or refugees from beyond its borders.,1
"The Conservatives may have surrendered every last joint of ideological backbone to the forces of Social Justice, identity politics and weaponised resentment.",1
"State-backed hackers from China have targeted staffers working on the U.S. presidential campaign of Democrat Joe Biden, a senior Google security official said on Thursday. The same official said Iranian hackers had recently targeted email accounts belonging to Republican President Donald Trump’s campaign staff.",0
"Human rights defenders have said security forces were deployed to enforce lockdowns mainly in poor black areas like high density townships, where higher population numbers and overcrowding made it impossible to properly isolate.",0
Lawmakers are treading a dangerous and unconstitutional path in the service of fear-driven objections to trans existence.,1
"Their lawyers argue that Title VII of the 1964 Civil Rights Act, which prohibits workplace discrimination based on sex, also applies to discrimination against LGBTQ people.",0
Welcome to 'Crazytown': An unprecedented frenzy in Georgia shows how democracy breaks down,1
"Harris, like her Democrat competitors at the time, signaled that she supports free, taxpayer-funded health care for illegal aliens, which by some estimates could cost up to $660 billion per decade.",1
"Trump is also attempting an obvious slow-motion coup, in which he is purging senior national security officials who have shown themselves unwilling to do his bidding, for example, by turning the country's military against the American people.",1
"After health officials near Portland, Oregon, declared a public health emergency over a measles outbreak that affects mostly young children, the viral infection continues to spread.",0
"A report by the United Nations (UN) falsely blamed President Trump for the detention of 100,000 migrant children who, in fact, were held in federal immigration custody in 2015 by President Obama.",0
"The police lynching of George Floyd provoked widespread denunciation, with even ghouls like Rush Limbaugh and Mitch McConnell condemning the individual officers responsible for the death. ",0
"Juneteenth, a portmanteau of June and 19th, also is known as Emancipation Day.",0
"Police shooting deaths and other deaths enacted by officers largely impacting the black community have been the focus of recent protests, yet other communities, such as the Latinx community, also suffer disproportionately from such violence, taking innocent lives.",0
"Russia’s central bank suspended gold purchases on the domestic market from April 1, without giving a reason. However, analysts have suggested it is focusing on foreign currency sales to support the rouble, which has fallen in line with lower oil prices as the virus spread.",0
"The number of women behind the camera on Hollywood movies jumped to record levels in 2019, with 12 directing top-grossing films including “Frozen II,” “Captain Marvel” and “Hustlers,” two studies showed on Thursday.",0
"The Trump administration said under the new agreement, the U.S. would also work with Sudan to help ease its debt burden and become a part of the broader international community. ",0
"It's no exaggeration to say that the anti-choice movement, from tip to toe, is stuffed with liars and grifters.",1
"Republicans will claim that they prioritize pro-life policies, and democrats will keep abortion sacrosanct.",1
Trump’s evangelical cabal are behind Republican attacks on women’s reproductive rights.,1
"While the major baseball leagues won’t be affected much by tariffs on Chinese imports, everyone from Double A players down through the office softball team will be.",0
"We must be wary of allowing those wielding the toxic charge of racism, no matter how well intentioned their motives, to decide who has a voice and who does not. ",1
"In Santa Fe, New Mexico, officials took down a statue of Diego de Vargas, a Spanish conquistador who brutalized Native Americans.",0
They found that many disadvantaged white students reject the notion of their grand privileges and resented the key confessional component of white privilege education.,0
"Federal government health officials told lawmakers the country had insufficient testing resources, a source said, and Democratic presidential candidates slammed the government’s response.",0
"Banks lamented that China has now become a partisan issue simply because Trump has blamed China for trying to hide the discovery of the coronavirus in Wuhan, China, and allowing it to spread to the rest of the world.",1
"Moreover, NeverTrump would not only have to separate Trump from his political base, but also to win the support of that base for its own candidate. That will be particularly difficult, as NeverTrump has made no secret of its general disdain for Trump supporters.",1
President Donald Trump on Saturday said the occupation was an example of what “radical left Democrats” allowed in the United States and offered to help end the “anarchist” protest “in an hour or less.”,0
The Trump administration is working on a plan to let the Social Security Administration (SSA) check up on claimants on Facebook and Twitter in order to root out fraud and abuse in the disability program.,0
The defendants did not admit or deny wrongdoing. Their lawyer did not immediately respond to a request for comment. The settlement requires court approval.,0
"In their place, Trump credits himself for early and stronger travel bans, even if the evidence now is about home-grown coronavirus spread.",1
"After years of being berated as racist or ignorant, Donald Trump reassures everyday Americans that their views are valid and their way of life is worthwhile. He lets them fulfill the only dream most Americans have: to live their lives as they please without harassment or contempt from their government.",0
"For our friends on the Left, Trump’s refusal to wear a mask is irresponsible toxic masculinity that is sending the wrong message and getting people killed, even though Dr. Deborah Brix has explained it’s not much of a risk. Biden, meanwhile, to their minds is leading by example by wearing his mask even when there is no good reason he should.",1
"In the video, while answering a question of whether conservatives have legitimate fears of Islamic terrorism and therefore justification for measures to stop it, she appears to say that white men are in fact a greater threat.",1
"Congress has not set an annual limit on the number of visa workers who can be sponsored for green cards, so the resident population of permanent “temporary workers” is growing fast — and is helping to suppress wages for American graduates.",0
"Trump and the petty politics of revenge: 'If the president doesn't act, people will die'",1
"Biden spoke passionately Saturday night about handing out food to children and adults with his wife, Jill, and his grandchildren earlier in the day as he blamed President Donald Trump, who has proposed and begun to implement deep benefit cuts for federal subsidies benefiting the poor",1
"But if there is one thing we have learned about Trump in the last four years, it's that he's a human earthworm: Every time he gets cut in half, he grows another tail using lies, cheating, and thievery.",1
"Far from inspiring confidence during a public-health crisis, Trump appeared awfully confused during his televised meeting with pharmaceutical execs.",1
"Hungarian Prime Minister Viktor Orban, a staunch anti-immigrant populist, said on Wednesday a new wave of migrants trying to cross the border from Turkey into the European Union must be stopped as far south as possible and his government was ready to help frontline Greece.",1
"Biden’s appearance was a contrast with the approach of Republican President Donald Trump, who has made no major public statement to address the growing crisis but issued tweets as he remained out of sight in the White House.",0
"This was not the president’s first gesture of warmth in the wake of Limbaugh’s sad revelation. The president took to Twitter to cheer him on, saying, “Many people do not know what a great guy & fantastic political talent the great Rush Limbaugh is. There is nobody like him. Looking for a speedy recovery for our friend!”",1
"Critical education has now turned into indoctrination on critical race theory. Some 4,500 classrooms have adopted the New York Times’ anti-American “1619 Project” into their curricula.",1
"U.S. prosecutors on Friday unveiled charges against 18 Portland, Oregon protesters ranging from assaulting police to arson and trespassing, a day after the Trump administration expanded the deployment of tactical police to Seattle.",1
"As this article was about to be published, Newsom added more claims about California’s success.",0
"Moreover, Rowling says she’s concerned that the radical activists have been allowed to become mainstream and that undue inculcation of the trans agenda into among the youth is causing an explosion of sudden transitioning among children — and mostly girls — because of peer pressure and not for medical or mental health related reasons.",1
"The hot new idea to tax America’s rich is a wealth tax, which – although designed to target the wealthiest taxpayers – could end up eventually hurting middle-class families.",1
"Democrats are gearing up to turn abortion into a key issue for the 2020 elections, saying it could turn out to be an issue that mirrors the fight to preserve the Affordable Care Act in 2018. ",0
"A recent piece in The Wall Street Journal by Walter Russell Mead has caused a bit of a stir among the chattering classes. Headlined “The Coronavirus May Make Trump Stronger,” it argues that President Trump’s abysmal and malfeasant handling of the greatest public health emergency in a century is a feature, not a bug, in his quest for a second term.",1
Trump attacking wind power is nothing new.,1
"U.S. health insurer Anthem Inc said on Wednesday it will not offer individual Obamacare plans in Maine in 2018, citing uncertainty over government operations, including whether it will provide subsidies to reduce costs under the Affordable Care Act.",0
"The normalization effort included softened rhetoric and social gatherings that, for many groups, would increasingly replace confrontational rallies.",0
"Given a certain level of mistrust, here are several public information topics for which we should remain on high alert for quackery.",1
The Senegalese was subjected to insults and monkey chants during the match against Inter Milan at San Siro on Boxing Day and was sent off for dissent late in the game with Napoli coach Carlo Ancelotti blaming his loss of temper on the atmosphere in the stadium.,1
"The Treasury Department has, quite flagrantly, violated a law that requires it to turn over any individual's tax returns to the House Ways and Means Committee upon request. ",1
"Now today, the San Francisco mindset is still, shall we say, peculiar. It’s a city, after all, where old-money trust-fund types, addled with guilt, have joined with nouveaux riche tech tycoons to create a bizarre overclass ideology that’s a part Karl Marx, one part MSNBC, one part Michel Foucault, and maybe even a little bit of Ayn Rand.",1
Politicians have no business directing or defining patriotism — especially when their rhetoric sounds like 1950s-era Soviet sloganeering.,1
"The police chief in Louisville, Kentucky said on Friday he intended to fire one of three officers involved in the shooting death of Breonna Taylor, a Black woman killed in a burst of gunfire when drug investigators entered her home.",0
Far right takes to Lisbon streets to deny racism is a problem,0
"Authorities are investigating seven fires set in violent protests in Washington over the weekend, and one person has been arrested and charged, said Regina Lombardo, acting director of the U.S. Bureau of Alcohol, Tobacco, Firearms and Explosives (ATF).",0
"The Democratic-led House backed Wednesday its first major gun-control legislation in years, but Republicans used the debate over it to try to put a focus on illegal immigration. ",0
"U.S. Treasury Secretary Steven Mnuchin failed to meet a final congressional deadline on Tuesday for turning over President Donald Trump’s tax returns to lawmakers, setting the stage for a possible court battle between Congress and the administration.",0
"Rowling has been branded a hater, even a “terrorist” who “wants trans kids to die” because she disagrees with the far left’s transgender agenda.",1
"Floyd died after a white police officer, Derek Chauvin, knelt on his neck for nearly nine minutes while detaining him on May 25.",0
"The network also hypes the idea that nonwhite immigrants are dirty and diseased, as well as inherently criminal.",1
"Yet when researchers in the U.S. have been so corrupt they have gone to jail, mainstream scientists still accept their research.",1
"But, yeah, good work each and every one of you reporters who made this fake story something to waste time on this week. You’re all hacks.",1
"In what could be construed as an act of treason, President Trump recently ordered such paramilitary groups and right-wing thugs to take up arms and to threaten Democratic-led state governments such as Michigan's in order to force them to ""reopen"" their state.",1
"Naturally, our fake news media and social media overlords attempted to twist the president’s warning into something it wasn’t — a threat, as in If you start looting, my government’s going to start shooting.",1
The United Nations chief urged faith leaders Tuesday to challenge misinformation about the coronavirus pandemic by promoting the World Health Organization and complying with its recommendations.,0
"The New York Times has a responsibility to exercise greater discretion, rather than publish racially charged clickbait like an article arguing white supremacists have an Asian woman fetish.",0
"When I opened Britain’s bestselling tabloid conservative Sunday newspaper, I was greeted by a double-page spread showing a vast mob of Black Lives Matter activists marching on Downing Street in London.",1
"Despite Democrats regularly characterizing America as socially pathologized with anti-woman “sexism” and “misogyny” — where women face greater cultural, economic, political, and social adversities relative to men — Warren framed her sex as a political asset in comparison to her male competitors for the Democrats’ presidential nomination to defeat President Donald Trump in November’s general election.",1
"White House Press Secretary Kayleigh McEnany voiced tepid support for Defense Secretary Mark Esper, after he stated Wednesday that he did not support invoking the Insurrection Act, which would allow active-duty troops to act in domestic law enforcement roles.",1
"Since the beginning, Biden has been grasping at the coattails of America’s first black president and relying on his administration’s laurels related to Obamacare, race relations, gun restrictions, and climate change.",1
The federal government is failing!': MSNBC host spits fire as he details Trump's ignorant and inept outbreak response,1
Girls and women do not have the same access to sports — and the profits and privileges and opportunities that come with them — as boys and men.,0
Tensions between Trump and the messaging platform escalated last week after Twitter began to label some of his tweets with a fact-check. Trump responded with an executive order that threatens to curtail some legal protections enjoyed by social media companies.,0
Union leaders met with senior congressional Democrats to discuss aid after a proposal from the Republican-led U.S. Senate on Tuesday for additional coronavirus relief did not include new government assistance for U.S. airlines or airports.,0
"Now, with Biden as the Democrat 2020 nominee, and Sen. Kamala Harris (D-CA) as his running mate, the anti-Catholic bias has not only continued, but intensified.",1
"That damage was in evidence in a report from the U.S. Labor Department, which showed just under 3 million new jobless claims last week, pushing the seven-week tally well over 36 million.",0
Secretary of State Mike Pompeo urged Afghans not to squander an opportunity for lasting peace in remarks to the summit between Afghan government and Taliban leaders here that represents the beginning of peace negotiations.,0
"For those who want equal representation, the sea of white maleness really sucked.",1
