text,bias
Even Trump’s own health care advisers know nothing about the ‘mythical’ health care plan he brags about,1
The explosion of the Hispanic population has long-term job prospect consequences as well: Both legal and illegal aliens will occupy 75 percent of new American jobs in as little as five years.,1
"Conservatives Win In Poland, And Leftist Media With No Better Ideas Calls It Bigotry",1
"The idea behind the conspiracy is that these miracle vaccines — and they are medical miracles — can cause autism, when there is no data to back that up.",1
"Also, Biden told a New Hampshire audience in February that PLCAA gave gun makers “a loophole that does not allow them to be sued for the carnage they are creating,” Breitbart News reported.",0
"Coach Guerrier adds that the referee’s continued mid-game scrutiny ultimately made “a spectacle” of her daughter, and that he continued to insist that something would have to be done as the child grows up and continues to compete in the sport.",0
"Yet the overwhelming narrative across social media today and, depressingly, across much of the mainstream media is that these ugly, sinister shows of force by the triumphant radical left are something almost charming and admirable rather than something we should all fear.",1
"he conservative Club for Growth Action group launched NeverTrumperChrisJacobs.com and launched an ad, claiming that Jacobs campaigned with Never Trump Republican Bill Weld as well as refusing to back President Donald Trump in 2016. ",1
"Surprising because in its early trailer, FX’s Anti-Phyllis Schlafly Series Mrs. America sold itself as a celebration of second-wave feminism as it waged righteous war against the dark forces of the “patriarchy.”",1
House and Senate Democrats are responding to the coronavirus outbreak in the United States by supporting measures to effectively strip President Trump of his authority to impose travel bans to protect American citizens.,1
"Protests over the police killings of George Floyd, Breonna Taylor, Tony McDade and other Black Americans have ignited a national conversation about the role of law enforcement in society.",1
Former Vice President Joe Biden asserted the Medicare for All proposal championed by his progressive rival Sen. Bernie Sanders (I-VT) would require massive tax increases.,0
"The devil in the data for Democrats, however, showed promising signs for a rebounding economy emerging from the dark days of the dystopian lockdowns as states began to reopen earlier this spring.",1
"He reiterated his criticism of the president’s response to coronavirus in the spin room after the debate, saying that Trump was incompetent.",0
It reminds us that a once-great university has fallen to the forces of wokist ignorance and that you’d really be better off trying to study for your degree elsewhere.,1
"The Trump administration and Congressional Republicans continue to seek cuts in food stamps and health care for children, as DCReport keeps advising readers.",1
There is no doubt that there have been U.S. government missteps on the path towards trying to control the spread of coronavirus.,1
"Dozens of potential jurors were excused on Wednesday from serving in the rape trial of Harvey Weinstein, as the former movie producer’s lawyers accused the judge presiding over the trial of bias.",0
"A California rock known for being a canvas for local artists, became the site of a neighborhood battle after ""Black Lives Matter"" artwork was painted over multiple times this past week, according to a report on Monday.",0
"Despite pre-existing and new guidelines, critical decisions made by governors and state leadership have, in some cases, exacerbated the crisis. In New York, Gov. Cuomo’s instruction for long-term care facilities to continue accepting patients with COVID-19 led to devastating results.",1
"Chinese state media outlets have been bursting with criticism for President Donald Trump during the current round of riots, but the Chinese Communist Party (CCP) also tossed a few bricks at former President Barack Obama and his Democrat Party, needling them for doing little about racial issues and touting China’s efforts to care for its poor and disenfranchised as vastly superior to the Democrats’ half-hearted socialism.",1
Warren’s speech included leftist talking points — from corporations’ alleged mistreatment of American workers and unions to the dangers of “cutthroat capitalism” and the pitfalls of free trade.,1
"The 2020 electorate seems to have about the same digestive system as a goose, which is to say that it doesn’t seem to hold on to anything for very long.",1
"Amid pressure from Washington, Mexico is backpedaling on promises of better treatment for Central American migrants, leaving hundreds stranded in unsanitary camps near its southern border and allegations of irregular detentions.",0
A lawsuit percolating through the courts attempts to weigh the religious liberty of Orthodox Jews with a dire and compelling public health interest.,1
That's why it's reasonable to be skeptical about the likely success of the current crop of wannabe Trumps. ,1
"As part of Pelosi’s coronavirus plan, House Democrats slipped in multiple measures from their H.R. 1 legislation that would implement nationwide ballot harvesting for federal elections — effectively allowing political operatives to collect and deliver an endless number of absentee ballots from voters.",1
"This is all great news. It now looks like we have a safe, highly effective vaccine that has the potential to significantly reduce many forms of cancer. So why is it also becoming a key target of many anti-vaxxers?",1
"Republicans should stop fighting amnesty, President Obama said on Thursday, because one day a Hispanic will become president.",0
U.S. women’s soccer team co-captain Megan Rapinoe is begging prominent male soccer stars to must begin agitating for political causes.,1
"In July 2019, Rep. Alexandria Ocasio-Cortez, D-N.Y., and other Democrats visited a similar processing center in Clint, Texas, and made explosive allegations about the conditions there.",1
"Then the tenor changed. What started as irony turned into an actual belief that white people, specifically white men, are more dangerous and immoral than any other people.",0
"On Friday, Trump said he remained ready to help South Korea and Japan solve their lingering dispute over World War II-era forced labor that has blighted their trade ties.",0
But Hedges also sees hope for saving the United States from imminent tyranny. Where? In the George Floyd protests and the possibility of revolutionary change.,1
"President Donald Trump's top health advisers – Anthony Fauci and Deborah Birx – showed up at a White House event Friday with protective masks, though the president himself continued to spurn any kind of face covering.",1
"Donald Trump used his mighty Twitter platform to drum up business for his golf course in Los Angeles on Sunday. U.S. deaths from COVID-19 neared 80,000, but the president didn’t tweet about that. ",1
Thousands of people across Australia attended Black Lives Matter protests on Saturday wearing masks and practising social distancing amid warnings from state leaders to call off the events on fears of a second wave of coronavirus infections.,0
"While falling short of calling half the nation “deplorable” as former Secretary of State Hillary Clinton did in 2016, the comments echo a deep disdain for a large population of the country increasingly perpetuated by left-wing elites in the wake of the George Floyd protests characterizing the U.S. as irredeemably racist.",1
"Shares of firearms sellers tumbled on Monday as promising data from a COVID-19 vaccine trial knocked stay-at-home stocks, and as civil unrest failed to materialize after Democrat Joe Biden emerged as the winner of last week’s presidential election.",0
"Job and revenue losses prompted by the coronavirus will likely accelerate the depletion of Social Security and Medicare reserves, U.S. officials said on Wednesday as they released reports showing little change in the federal benefit programs’ pre-pandemic finances.",0
A Black policewoman was injured and at least four people stabbed when a day of demonstrations in support of President Donald Trump's election delusions ended in violence Saturday night in Washington D.C. ,0
The increasingly bitter dispute between American women’s national soccer team and the U.S. Soccer Federation spilled onto the field Wednesday night when players wore their warm-up jerseys inside outin a protest before their 3-1 victory over Japan.,0
"They all swing radical left, they all pay homage to the identity politics pieties of the Social Justice movement, they all brutally enforced conformity on #MeToo, and now they’re doing the same with Black Lives Matter.",1
"Facebook, YouTube and Amazon all answered with policy changes, removing some fear-mongering content related to vaccines.",1
"Jurek, a Sanders staffer in Iowa, was caught arguing that gulags were beneficial for the Soviet Union and suggesting they could be used to re-educate both Trump voters and billionaires.",1
"Greek leftists in the city of Thessaloniki set fire to an American flag in front of a United States consulate, claiming to be doing so in solidarity with “U.S. insurgents”.",1
The New Way Forward Act is the single most radical piece of legislation we have ever seen proposed in this country — ever.,1
"Right wing demonstrators fought with leftist counter protestors in Georgia, Michigan and Oregon on Saturday drawing in riot police and SWAT teams.",0
"The 81,000-plus transactions in June also set the all-time record for more transactions in a single month, since Virginia State Police “began tracking [transaction] data in 1990.”",0
"Of course, viruses don’t just “go away” regardless of the amount of propaganda or wishful thinking you throw at them. His theory, however, is telling. Trump’s strategy from the beginning of this crisis has been to minimize the threat and wish it away.",1
"The odds of giving birth prematurely was also higher in pregnant and recently pregnant women with COVID-19, compared to those without the disease.",0
"As the number of Americans eligible for the Medicaid low-income health insurance program grows through expansion under the Affordable Care Act (ACA), some states are aiming to trim the rolls by requiring recipients to work or satisfy related criteria. ",0
Lightfoot stressed her belief that the election of Joe Biden to the White House is key to securing these and other controls for Chicago and the rest of the country.,0
Democrats effectively nationalized the student loan industry in 2010 by transferring eight million loans into the federal government’s hands.,0
"But President Donald Trump and his campaign advisers are proceeding with the event, which is expected to draw tens of thousands inside and outside the venue who will neither be socially distant nor required to wear face coverings.",0
"A sharp drop in temperatures and wind speed, combined with vehicle and industrial emissions, dust from building sites and smoke from garbage burning has boosted pollution over much of north India, including New Delhi, home to more than 20 million.",0
"Lawyers for Bill Cosby on Thursday asked the Supreme Court of Pennsylvania to hear his appeal of his 2018 sexual assault conviction, a month after a lower court rejected their argument that the disgraced comedian did not get a fair trial.",0
The White House said on Monday that President Donald Trump was not firing U.S. infectious disease expert Dr. Anthony Fauci despite his retweet of a supporter’s #FireFauci message.,0
"The same goes for Govs. Gavin Newsom, Andrew Cuomo, Jay Inslee, and every other Wuhan virus Karen issuing diktats from on high.",1
"President Donald Trump personifies the impulse to ignore the peril while insisting on prejudice, rather than science.",1
"Conspiracy theories about the Sandy Hook shooting have persisted for years, for example, far-right InfoWars host Alex Jones claimed that the whole thing was staged by the government with child actors and no kids were harmed ― which ultimately led to a lawsuit against him by parents of the victims.",0
The Border Patrol has said Hernandez was pelting U.S. agents with rocks from the Mexican side of the Rio Grande when he was shot.,0
Left unsaid is that Obamacare — through its myriad of reporting mandates such as cumbersome electronic health records — is largely responsible for this paperwork burden. ,1
‘The most progressive president since FDR’: Biden's policy proposals reveal a pleasant surprise,0
"Surges in U.S. firearm sales have in recent decades been predictably driven by events sparking fears of impending gun-control legislation, such as the election of a Democratic president or a spate of mass shootings, federal gun background check data show.",0
"An investigative journalist whose exposés on the deep-rooted corruption in African soccer led to the downfall of a member of the high-powered FIFA Council was shot dead Wednesday, months after a Ghana politician called for retribution against him.",0
"Here's the first thing to notice about the horrific news cycle of the past few days: Donald Trump is openly stoking right-wing violence, in no small part, because it bumps the coronavirus pandemic (6 million cases and rising, more than 183,000 dead) and the economic crisis (10% unemployment and 29 million Americans going hungry) out of the headlines.",1
"In Saudi Arabia, the government expanded its decision last week to ban foreigners from making the pilgrimage to Mecca and Medina – home of the holiest sites in Islam.",0
"Under Colorado’s new “red flag” law, family members and law enforcement officials can petition a court to temporarily take a gun away from an individual they believe to be a threat to themselves or others.",0
"Ultimately, the rejection of mask-wearing really goes back to the fact that Trump, Ingraham and their most faithful followers are guided by fascist impulse, even when they don't or can't articulate a fully fleshed-out fascist ideology.",1
The left-wing mob had gathered in Parliament Square in London in defiance of the coronavirus lockdown to protest over the death of George Floyd in the United States and the supposed implicit racism they believe is ingrained in the British and American systems of government.,1
"Trump wore no face mask nor any other protective gear, which is typical for him, despite recommendations to the contrary by the Centers for Disease Control and Prevention. He stopped to talk to employees — who were wearing white lab coats, masks, gloves, goggles, hair coverings and plastic booties — while they were working with the sterile swabs.",1
Juneteenth represents the day that black slaves in Texas learned that they were free.,0
Students across India on Tuesday stood in solidarity against a vicious weekend attack on a prestigious New Delhi university by masked men wielding sticks that led to 40 students and staff being sent to the hospital.,0
The left-wing Antifa and Black Lives Matter terrorists will probably try to attack the suburbs and Rural America in an indirect way — going after power stations and the like.,1
"Those losses could be offset by efforts from activist group’s such as Ralph Reed’s Christian Coalition, which plans to spend tens of millions of dollars to identify and register new religious conservative voters and rallying right-wing Christians.",0
Many Democratic congressional candidates in 2018 attacked Republican opponents for bowing to the gun lobby.,1
"Despite repeated setbacks, Smart made history as the first American to reach No. 1 in the world in saber fencing and later was on the silver-medal winning U.S. team in the 2008 Olympics.",0
"During a meeting on the coronavirus Monday, Trump asked a group of pharmaceutical CEOs if a vaccine would ""make you better quicker,"" indicating the president does not fully grasp that a vaccine would prevent, not treat, the virus.",1
"Sen. Ernst’s flippancy shows how little she and other Republicans think of the grannies and grandpas, dads and moms, and working men and women who have broken their backs to pay taxes and provide for their families.",1
"My appreciation for Rural America has only grown as the lunacy of blacklists, rioting, looting, woke fascism, and a full-blown CHAZ has spread like a malignant cancer throughout dozens of Democrat-run cities.",1
The positive test for a banned substance comes as a major embarrassment to Australian swimming given the headline-grabbing podium protest that 400 freestyle silver medalist Mack Horton made on Sunday over Sun Yang’s participation at the worlds.,0
"They gobble down internet conspiracy theories like QAnon, which creates engagement with right-wing politics for those who aren't religious conservatives or business elites. ",1
"Biden, the former vice president making his third run for the White House, said Trump’s tax cuts for the wealthy and other economic policies were increasing economic inequality in the United States.",0
"In court and in public, the administration defended the extreme and disruptive measure being based on national security considerations, though it was clearly an instantiation of Trump’s bigoted campaign promise to end all Muslim immigration to the United States.",1
"FNC’s Carlson Slams Cowering, Dithering American Leaders for Riot Response — ‘This Is How Nations Collapse’",1
"The outbreak, which began in the Chinese city of Wuhan, has wreaked devastation on the global economy and threatens to plunge hundreds of millions of people into poverty.",0
United Airlines said Tuesday it would suspend 24 flights between the U.S. and China the first week of February amid growing concern about the spread of the coronavirus that originated in the Asian nation.,0
"Under President Reagan, church and state became inextricably intertwined and have remained so, with the Trump administration’s backing of “religious freedom” and “religious liberty” as battering rams against LGBTQ rights and reproductive choice.",1
"Those activists will, of course, all be on the left — watermelons, essentially: green on the outside, red on the inside — and will continue to promote environmentalism by whatever means possible in order advance the controlling agenda of global eco-fascism.",1
Muslims should not even be allowed to seek positions of political office in this country.,1
"The community leaders at Wilmington’s Bethel AME Church urged Biden to pick a black vice presidential running mate, and said the protests were a reflection of frustration about the lack of attention and resources for African-American communities.",0
"We might note that at the time of this Texas ruling, national liberals were spluttering with outraged opposition.",1
"Legions of 'trainers' holding up 'White Fragility' are indoctrinating government agencies, corporate workforces, and schools.",1
Bloomberg looked like that 3-point favorite in college football walking into a trap game unprepared/looking ahead on the road and getting walloped by the home dog.,1
"That response, Americans would learn days later, would include a move widely seen as escalating aggression in the region rather than alleviating it: A U.S. drone strike targeting Iranian Major General Qasem Soleimani, the second most powerful leader in Iran and commander of the Quds Force of the Islamic Revolutionary Guard Corps.",0
The American president’s threat to reverse that decision and impose the metals tariffs is the latest example of his mercurial approach to trade policy.,1
"The Trump tax cuts also doubled the child tax credit and expanded its eligibility, which greatly helps the American working-class family.",0
How Transgender Athletes Are Poised To Ruin Girls’ Sports,1
There is no evidence to support the allegation Pelosi was trying to include abortion funding in the coronavirus emergency bill as the Facebook post claims.,0
"Ever since Democratic presidential candidate Sen. Elizabeth Warren (D-Mass.) revealed her plan to forgive student debt and make public universities free on Monday morning, the internet has been a carnival of bad faith, magical thinking and misinformation about the nature of college costs in the United States.",1
"Moynihan never described the specific spiritual benefits that would arise from the kind of cutbacks needed to solve a future government debt crisis. But in explaining how excessive public spending undermines traditional values, he was clearly suggesting subsequent belt-tightening could have the reverse effect.",0
Proponents of stricter protections for students argue the DOE’s recent rollback of Obama-era rules aimed at protecting students from predatory for-profit colleges will only lead to even more student defaulting on their loans.,1
"Five United States military sites were chosen to participate in the third phase of the COVID-19 vaccine trials, the Pentagon announced in a statement provided to Fox News Thursday.",0
"This kind of over-the-top misogyny is, not surprisingly, being accompanied by an absolute barrage of violent fantasies from the gun lovers who plan to descend on Richmond on Monday.",1
Gay and bisexual men in Scotland prosecuted for consensual same-sex activity will receive an automatic pardon under a law which came into effect on Tuesday aiming to correct a “historic wrong” but stopped short of offering compensation.,0
"Trump is “angry” that intelligence officials informed Sanders and other members of Congress about some of Russia’s meddling efforts in the 2020 election cycle, Biden said, adding that the administration must do more to secure the integrity of our elections.",1
"Abortionists, who prey on desperate people, should no longer receive your hard-earned tax dollars.",1
U.S. President Donald Trump said on Sunday he would raise tariffs to 25 percent from 10 percent on $200 billion of Chinese goods.,0
"The spectacular rise of human civilization that took place during the last 10,000 years now appears to be coming to an end with the refusal of our species to significantly curb the carbon emissions and pollutants that might cause human extinction.",1
"Israel has a vested interest in escalation, not de-escalation, with Iran.",1
China appears to be feeding off similar complaints from the left in the United States. Complaints about partisan “gridlock” are perennial and grow especially loud when Democrats and their highly sympathetic media are the ones complaining about Republicans getting in their way.,1
"House Democrats passed the $3 trillion, 1,815-page leftist Heroes Act in May, which many House Democrats reportedly admitted serves as more of a “policy wishlist” than a bill to alleviate the effects of the coronavirus pandemic.",1
"During a nationally-televised press briefing President Donald Trump suggested doctors and scientists should test the “injection” of disinfectants, like bleach or alcohol, into the human body as a way to cure coronavirus.",0
"Bernie Sanders Is Crazy, But The Only Democrat Candidate Voters Actually Like",1
"Brandon Straka, founder of the #WalkAway campaign encouraging Americans to leave the Democrat Party and left-wing ideology, told Breitbart News on Saturday that many participants in the Women’s March in Washington, DC, don’t really know why they’re here.",0
Harris is also pushing legislation that would dramatically expand the legal and financial incentives for hundreds of thousands of Indian low-wage college graduates to take U.S.-based jobs from U.S. college graduates.,1
"Biden would be a disaster for small businesses, their employees, and their communities.",1
"But the new restrictions on H-2A visas could leave West Coast farmers in the lurch just as they are preparing to harvest lettuce, cabbage, broccoli, celery and strawberries, said Dave Puglia, president and CEO of the Western Growers Association.",0
"Though the author reserved much of his political bile for Democrats, he also attacked Republicans and espoused some left-wing views, claiming that “our lifestyle is destroying the environment of our country.”",1
Long argued the hypocrisy of woke white women demanding change for women and transgenders has moved the political conversation far away from the original discussion of police brutality and racial equality.,1
"Floyd, 46, who died in police custody after an officer kneeled on his neck for over eight minutes -- is set to be laid to rest next to his mother in the suburb of Pearland after six days of mourning and memorial services spanning several cities and states, including Minneapolis, Minn., and North Carolina.",0
"On Tuesday, Governor Roy Cooper rejected Republican demands to guarantee that attendance at the convention in Charlotte would not be restricted by social-distancing measures aimed at preventing the spread of the coronavirus.",0
Hate is the GOP brand under Trump and sadly it’s working to attract like-minded people to its ranks.,1
The poll results came as new rules brought in by the so-called Conservative government mean schools in England will be forced to hold mandatory “LGBT-inclusive” sex education including the promotion of gender ideology.,1
"Unfortunately for you non-Texans, Gov. Abbott's extreme gooberness is now surging across our borders to afflict people in your state.",1
"Confusion, complaints of missing mail-in ballots and long lines at some polling centers marred primary elections on Tuesday in eight states and the District of Columbia, the biggest test yet of voting during the coronavirus outbreak.",0
