text,bias
"Even if you don’t speak white nationalist dog whistle, this speech is pretty shocking. Hawley is claiming that the United States is run, and has been run, by a secret group of international “elites” who value terrible things—such as education, achievement, and progress.",1
"Democrats are suddenly obsessed with Lev Parnas, the Rudy Giuliani associate who was indicted on federal campaign charges last fall.",1
"During the segment, Colbert also bemoaned the fact that Barack Obama is no longer president.",0
"After all, America’s commander-in-chief does have the authority, at his sole discretion, to order the launch of weapons from the vast U.S. nuclear arsenal.",0
"According to white nationalists who promote the Replacement Theory, enemies of the white race are seeking to “replace” whites with non-whites in the United States and many other countries. ",1
It’s one of the most common forms of political pornography among the online Left.,1
"In a scaremongering article on Monday, the Gray Lady warned that corners are being cut in the search for a vaccine and that it is politically motivated.",1
"The New York Times described Sunday’s nationwide riots as a wave of police violence against “protesters and bystanders,” even as law enforcement abandoned large urban areas to rioters and looters who ran amok for hours.",0
"Imagine the outgoing, losing president, doing his level best to sabotage and hamstring the man who beat him in the election, alternatively whining and threatening elected Republican officials, demanding a list of those opposed to him, so that he could single them out for punishment.",1
Andrew Cuomo Has A New Plan To Kill New Yorkers,1
Nations including the Netherlands and France are seeking to convince fellow European countries to end tax exemptions on jet fuel and plane tickets.,0
"Trump has been able to maintain 40% approval ratings by effectively manipulating the lizard brains of white Republicans, but even before COVID-19 hit, he was considered one of the worst presidents in the two surveys of scholars done in 2018.",1
Now researchers have offered an explanation: A study published Tuesday in the open peer-reviewed journal Proceedings of the Royal Society B finds that the microorganisms in the wax worm's gut help them consume and metabolize plastics.,0
"And rather than falter or die of old age, the expansion has continued through Trump’s first three years in office, giving him a trump card in the campaign to win a second term in November.",1
"Democrats recently provided more funding for the state’s roads — through an unpopular, regressive gas tax hike rather than spending cuts on less urgent priorities.",1
"The Palestinian Authority (PA) will no longer accept tax revenues collected on its behalf by Israel following its decision to trim the sum over the PA’s financial support of militants’ families, Palestinian President Mahmoud Abbas said.",0
South Africans have taken to the streets in recent weeks to protest police brutality in townships in an echo of the Black Lives Matter protests in the United States.,0
Privacy advocates on Monday raised concerns over reports that Indian security forces used facial recognition technology to identify dissidents at a political rally in December and warned that if left unchecked the government would continue to suppress dissent.,0
"Reports that dozens of Iranian-Americans were detained at the U.S.-Canada border on Saturday and questioned about their “political views and allegiances” were met with alarm by lawmakers and rights groups, particularly given the soaring military tensions between Iran and the U.S. following the Trump administration’s assassination of Iranian General Qasem Soleimani.",0
The second case was on whether a person’s claimed sense of “gender identity” allowed them to claim workplace sex-discrimination against their transgender status.,1
"It is no wonder why Republicans insisted on ramming through incredibly unpopular tax cuts for American corporations that were already making near-record profits, even at the risk of losing control of the House of Representatives. ",1
Democrat presidential hopeful Sen. Amy Klobuchar (D-MN) attempted to slam Democrat challenger former New York City Mayor Michael Bloomberg after he said it takes him a “long time” to get materials together to release his tax returns and claimed he “can’t go to TurboTax.”,1
"A fifth of U.S. trans people reported discrimination when seeking a home, and more than one in 10 say they have been evicted for being trans, according to the National Center for Transgender Equality.",0
"Though the lone vice presidential debate was far more civil than the mind-melting presidential debate last week, it was not much different in substance. ",1
"The eyes of the political world are on South Carolina, where over half of the Democratic primary voters are black.",0
"Marianne Williamson, the self-help guru who warned of the “dark psychic force” unleashed by Republican President Donald Trump, suspended her quixotic outsider campaign for the 2020 Democratic presidential nomination on Friday.",1
"Public attention is a strange beast. Communities of color have known for endless years that the police can kill them with impunity, and it's not as if people haven't been saying so for decades.",1
"Fauci has consistently done media interviews with a range of outlets, which has annoyed the president, this person said.",0
"In recent months, Trump has begun aggressively attacking mail voting, a process that is standard in some states now and which many others are expanding because of concerns that in-person voting could spread the coronavirus. Trump has repeatedly claimed that expanding voting by mail will let Democrats cheat, even though he, his press secretary and a top adviser have all voted by mail in recent elections.",1
Trump is already bungling the coronavirus response — and it could get much worse,1
An Iowa caucus voter has received a lot of attention after a video captured Monday night showed her requesting her vote back when she learned that Democrat presidential hopeful Pete Buttigieg is gay.,0
"Trump and his team have confronted years of questions about their competence and ability to tackle routine governmental tasks. Occasionally, those concerns are especially acute.",1
"As widespread protests over racial injustice roiled the country, LGBT+ campaigners on Monday, the start of the annual Pride month, called for a return to the rebellious origins of the U.S. gay rights movement.",0
"She’s among four dozen or so people gathered outside on a hot late-summer morning, joining a hard core of activists who believe that all vaccines are dangerous and who have become increasingly emboldened about denouncing the medical establishment.",0
"President Donald Trump on Sunday said he was never briefed about Russian efforts to pay bounties to Taliban-linked militants to kill U.S. troops in Afghanistan, blasting a New York Times report that he was told about Moscow’s cash rewards but did not respond.",0
"Civil rights activists across the United States for years have called for scaling back traditional policing, and the efforts have gained momentum through protests over the death of George Floyd in Minneapolis police custody last month.",0
Even though Thunberg is capable of doing things many on the right refuse to do — such as read and understand scientific evidence — right-wingers argued that Thunberg and her fellow youth activists cannot think for themselves.,1
"Sallie Mae sales employees were rewarded this week with a five-day, all-expenses-paid trip to Hawaii for achieving a record year of $5 billion in student loans, adding to the reported $1.6 trillion in student loan debt for Americans.",0
"Fauci, one of the most trusted faces of the coronavirus task force, said he would not be comfortable with a vaccine rushed through under Emergency Use Authorization.",0
"WHO is working to ensure fair vaccine distribution, but in the meantime it is key to suppress the virus’s spread, said Mike Ryan, head of WHO’s emergencies program, as daily new cases around the globe are at near-record levels.",0
"The New York Times recently published a fairly detailed fact-check of these Trump World arguments that democrats don’t mind executing babies after birth, and not surprisingly, the rhetoric is irresponsibly wrong.",1
"Andres Iniesta, the former Barcelona captain and World Cup-winning Spanish soccer star, apologized Tuesday after being criticized for posting a picture of him posing with two people clad in blackface during a popular Christian celebration.",0
"In other words, it would be much harder to arrest an illegal alien in this country than it is to arrest you.",1
"Memories of smashed windows, stolen merchandise and stores set ablaze is fresh in the minds of business owners in major U.S. cities including New York, Los Angeles and Portland, where aggressors damaged buildings under the cover of peaceful demonstrations sparked by the May 25 police killing of George Floyd, a Black man.",1
"Furthermore, the president has repeatedly and infamously made sweeping, overtly bigoted comments about minority populations",1
Anti-vaccine groups take dangerous online harassment into the real world,0
"Abortion ends lives, hurting women and preborn children.",0
"The problem, Ocasio-Cortez complained, wasn’t that the cost of the college was prohibitively high but that the student was not offered any large discount in the form of scholarships.",0
"Global cooperation is key to ensuring the security of 5G networks, cyber security officials said on Thursday at a meeting in Prague aimed at hammering out how to combat threats as nations begin rolling out next-generation telecoms equipment.",0
"Despite police officers in several parts of the country joining peaceful protests against police brutality, far-left agitators engaged in round-the-clock destruction of businesses and residences, including the burning down of an affordable housing complex in Minneapolis.",0
"Experts have warned that a total U.S. withdrawal from Syria, which is still embroiled in a chaotic civil war spawned eight years ago by protests against dictator Bashar al-Assad, would advance the interests of Iran and Russia.",1
"But, whether this switch constitutes a true win for the racist right or not, it’s clear that MAGA conservatives are highly attuned to how decisions are made in the White House and which positions they want to control.",1
"Firearm sales surged anew in 2020 due to fears related to the pandemic, and following social unrest in several U.S. cities and calls to defund police departments.",0
"The protest was part of ongoing nationwide demonstrations against the killing of George Floyd by police in Minneapolis, Minnesota, last week.",0
"There were many reasons that Trump defeated Clinton in 2016, and sexism was surely among them. ",1
The protests in London come days after Black Lives Matter and Antifa flooded the streets of the British capital over the weekend — with little to no regard for the government-mandated social distancing — calling “to burn this shit down” and hailing the chaos and riots in America as a sign that the “West is Falling”.,1
Trump has also repeatedly lied about important details regarding the COVID-19 outbreak.,1
"Ocasio-Cortez, who advocates for democratic socialism, is not the only Democrat in Washington, D.C., honing in on billionaires these days.",0
"Utah barred abortion after 18 weeks last year, becoming one of several states to adopt strict bans. ",0
"Peace was one of many transgender service members who spoke out against Trump after he announced on Twitter in July 2017 that the military would no longer allow transgender individuals ""to serve in any capacity."" ",0
"A 24-year-old woman in Uganda, unable to travel due to coronavirus restrictions, was burned by her Muslim father for purportedly converting to Christianity, according to a persecution watchdog group.",0
"Until recently, there seemed to be no broader plan behind NeverTrump’s early, and vigorous, opposition to Trump and his administration. But the contours of a plan have begun to emerge, particularly on social media, where the movement’s criticism of Trump alternates with praise for some of his opponents in the 2016 Republican primary.",1
"That nationwide backing for America’s stated goal of equal rights for all has been met by a rise in hate-related activities is part of a decades-long pattern in the United States, six scholars and historians say - any expansion of civil rights for a minority group leads to a rise in intolerance.",0
"The bill would also provide a massive giveaway to the many technology, banking, insurance, and staffing companies that have replaced a huge number of U.S. graduates with large blocs of compliant Indian and Chinese graduates.",1
"Donald Trump, the latest political demagogue to employ the term as a rhetorical bludgeon against peaceful protesters, can look forward to sitting alongside Sen. Joseph McCarthy, former Alabama Gov. George Wallace, Chicago Mayor Richard J. Daley, who ordered police to attack political demonstrators at the 1968 Democratic convention, Richard Nixon and many foreign dictators in the annals of history — and if there is an afterlife, in the middle of the inferno.",1
Trump said law enforcement officers would only be allowed to use chokeholds if their lives are in danger.,0
"Even as U.S. immigration officials have pushed to deport hundreds of Iraqi Christians over the last few years, asserting in court that they are unlikely to be targeted in their homeland, another arm of the Trump administration has insisted just the opposite, saying that Christians in Iraq face terror and extortion.",1
"Some moderate Democrats have criticized that proposal, arguing that it would burden the wealthy and middle-class to help the working class, or that it would raise the national debt, which is currently $23 trillion.",0
"There is a growing push within the Trump administration to craft a list of retaliatory measures against China over its role in the coronavirus outbreak, three sources, including a U.S. official, familiar with the matter said, but cautioned the efforts were in early stages.",0
"Witness, for instance, the wacky nonsense New York mayor and current Trump flunky Rudy Giuliani addressed to Salon's Roger Sollenberger during a text interview this week. ",1
"The number of abortions performed in 2017-2018 was 11,373 more than the abortions performed the year before that, a trend that shows that while Planned Parenthood officials once said abortion should be “safe, legal, and rare,” today they omit the word “rare” in their mantra as they perform more abortions each year.",0
"There is no doubt that discrimination plays a role in this wage gap, but there are other factors that deserve attention.",0
"The Guardian, insisting that the climate emergency is “the defining issue of our times,” has amped up its climate agitation by suggesting that Australian wildfires is the new normal.
",0
"The case of Rahaf Mohammed al-Qunun drawn new global attention to Saudi Arabia’s strict social rules, including a requirement that women have the permission of a male “guardian” to travel, which rights groups say can trap women and girls as prisoners of abusive families.",0
Even a member of French President Emmanuel Macron’s La République en Marche! (LREM/Republic on the Move) slammed the sports hijab.,1
Six Republican Senators have failed to develop a coalition for their plan that exchanges a fifth of border wall funding for an amnesty for illegal aliens and increased immigration.,1
"While President Trump visited the southern border Thursday, Democratic darling Beto O’Rourke visited the dentist — posting a bizarre video showing him getting a mouth-wide-open cleaning in order to highlight the story of his dental hygienist’s upbringing in El Paso.",1
"On Wednesday, democrats got a chance to grill President Donald Trump's point person on deregulation as Andrew Wheeler came to Capitol Hill for his confirmation hearing to be the next permanent administrator of the Environmental Protection Agency.",1
"European states are trying to accelerate a plan to shift thousands of foreign Islamic State militants out of Syrian prison camps and into Iraq, as a fresh conflict in Syria has raised the risk of jihadists escaping or returning home.",0
"Britain’s parliament has rebranded itself with possibly the wokest logo evah: a rainbow flag which invokes simultaneously the racial harmony of South Africa, the quiet dignity of Black Lives Matter, the modest restraint of the transgender movement, the subtlety of LGBTQ and the scientific and economic integrity of the green movement – all in one multicoloured vomiting splurge of rainbow-hued diversity.",1
"Now Democrats have upped the ante, threatening an even greater disruption to federal checks and balances by knocking down some of the last few remaining constitutional barriers to their permanent governance.",1
The Trump administration shelved a document created by the nation's top disease investigators with step-by-step advice to local authorities on how and when to reopen restaurants and other public places during the still-raging coronavirus outbreak,0
"Texas Gov. Greg Abbott on Friday became the first governor in the country to refuse to take in refugees, but 18 of his 26 Republican counterparts have chosen to open the door to refugees, much to the surprise of the Trump administration.",0
LGBTQ health experts said Always's decision to remove the female signs from its products is an ostensibly small change that may have significant consequences for trans and nonbinary people.,0
The death of Ruth Bader Ginsburg may have already doomed Obamacare,1
"Naturally, of course, right-wingers reacted in the ugliest way possible: By arguing that Thunberg’s identity — as a young person, as a person on the autism spectrum and, although they are careful not to say this directly, as a girl — inherently discredits what she has to say.",1
"In these times of left-wing mobs filling the streets, assaulting civilians and police officers, destroying property with apparent impunity, flagrantly defying coronavirus social distancing rules, and even seceding from the Union, one of the few consolations for conservatives is the notion that gun rights appear to be safe for a generation to come. ",1
"The picture that emerges is of a system of staggering complexity, riddled with obstacles and cracks, that prioritizes babies over mothers, thwarts women at every turn, frustrates doctors and midwives, and incentivizes substandard care.",0
"Floyd’s death has added to the disquiet among Black residents in Tulsa, which saw its own demonstrations in 2017 after a white police officer was acquitted of manslaughter for shooting a Black man during a routine traffic stop.",0
"On top of the enormous financial impact, these beauty regimens require these women to take the time out of their busy schedules to attend to their appearances in a way that men in power are spared. ",0
"The man who allegedly opened fire at a Walmart in El Paso, Texas, this past August, killing 22 people and injuring 24 others, was handed a 90-count indictment charging him with federal hate crimes Thursday.",0
A Texas law requires contractors who work for or do business with the state to certify that they do not boycott Israel or Israeli-occupied territories.,0
"The coronavirus pandemic, enabled and accelerated by Donald Trump, has killed more than 60,000 Americans. ",1
In contrast to former Justice Anthony Kennedy — a Ronald Reagan nominee and right-wing libertarian — Thomas has been an unyielding culture warrior.,1
Apple and Google are facing criticism for offering an app that lets men in Saudi Arabia track and control the movement of women.,0
Democrats have made it clear they will sandbag the people we’ve elected to govern if we refuse to vote for Democrats. ,1
Lesh pins the blame mainly on the statist bureaucracy mentality of Public Health England (PHE).,1
"Far-right talk show host Glenn Beck is being slammed by everyone from liberals and progressives to Never Trump conservatives for his idiotic argument that if older Americans have to die from coronavirus, so be it — it’s better to end social distancing and get the U.S. economy back on track than to maintain social distancing and keep hurting the economy.",1
"Rep. Al Green (D-TX) at a hearing on Wednesday perpetuated the hoax that President Trump called white nationalists at a rally in Charlottesville, Virginia in 2017 “very fine people.”",1
While Democrats were busy diverting the attention and energy of the entire country into a pointless trial that could not possibly have ended in anything other than President Donald Trump’s acquittal...,1
"Armed police supporters and anti-racism demonstrators clashed in Louisville on Saturday before the Kentucky Derby horse race, while Rochester police used tear gas to disperse protesters, as discord in cities across the United States continued to simmer.",1
"Since the incident, the mainstream media — in accordance with its new role as the left-liberal Establishment’s fully compliant harlot — has been on a mission to destroy Hepple.",1
"Anyone who has seen the Sky series Chernobyl will recognise the kind of stolid, bureaucratic mindset captured in this damning paragraph from the report.",1
The American middle class is falling deeper into debt to maintain a middle-class lifestyle.,0
"This includes children that officials have stolen from their families, done so with full knowledge that family separation and detention cause long-term harm to children, and done so with the fact that for the first time in years, migrant kids have died under U.S. watch.",0
"China’s economy has been slowing since last year as the trade war with the United States took a toll on factory activity, exports and domestic demand, suggesting that a spate of stimulus measures - including tax cuts and easier lending rules - have yet to have a notable effect on overall growth.",0
"The American Psychological Association has said it was aware of reports of growing “eco-anxiety” in children, but research was needed to establish how common it was.",0
Trump's nomination of Amy Coney Barrett: Another step toward Christian fascism,1
"President Trump poked fun at Sen. Amy Klobuchar, D-Minn., Sunday for vowing to tackle climate change as she kicked off her 2020 presidential campaign in a snowy, freezing Minneapolis park.",1
Nine drugmakers racing to develop a COVID-19 vaccine in the U.S. and Europe have signed a pledge to put safety first and adhere to scientific guidelines amid growing public skepticism and pressure from the White House to release a vaccine by the end of the year.,0
"Democrat leaders have distanced themselves from the push to “defund the police,” which has become a battle cry for many Floyd protesters.",0
"U.S. congressional Democrats on Saturday headed for a showdown with the Internal Revenue Service over President Donald Trump’s tax returns, setting a new hard deadline of April 23 for the federal tax agency to hand the documents over to lawmakers.",0
"A previous boom that saw gun sales double over a decade through 2016 corresponded largely with Democratic President Barack Obama’s time in office, when fears that gun control laws would be enacted drove gun aficionados to stock up.",1
A total of 61 Democrats have signed onto a House Resolution demanding President Trump import five times the number of foreign refugees that have arrived this Fiscal Year.,0
"So the goal is to keep people poor, keep ’em scared, keep their schools crappy (no school choice, no charter schools), tell them there’s no hope because America is evil and racist — in other words, keep ’em voting for Democrats.",1
"The left’s blacklisting rampage is already in full force, and only getting started.",1
"While corporate media, hypocritical politicians, and others labeled anyone in favor of reopening the economy, getting kids back in school, and even gathering for holidays a “grandma-killer,” one “expert in ethics and health policy” in the New York Times says that vaccinating elderly people first is racist.",1
"Samoa on Thursday closed all non-essential public and private services for two days to combat a measles epidemic that has killed more than 60 people, mostly babies and children, in a battle complicated by a vocal anti-vaccination movement.",0
"On Chicago’s Magnificent Mile, for instance, stores like Gucci, H&M and Nordstrom are open but remain clad in plywood, having being looted months ago.",0
"Vice President Mike Pence repeatedly made false claims about the Trump administration's coronavirus response as he dodged, interrupted and obfuscated through the vice presidential debate on Wednesday.",1
"The switch from Obama’s Making Work Pay tax break to the Republican payroll tax reduction effectively raised taxes on 51 million households by an average of $134 each, the Tax Policy Center estimated at the time.",0
"On Tuesday, President Donald Trump will give an Oval Office address on the government shutdown he created, during which he presumably will lie through his teeth to defend his highly unpopular immigration agenda.",1
"Warren, who unlike Sanders, claims her Medicare for All plan would not result in a middle class tax hike, released her plan to transition to Medicare for All in a Medium post in November.",0
"Likewise, Pelosi’s HEROES Act would provide business with a neverending flood of cheap, illegal foreign labor that they would be legally allowed to hire over the roughly 36.5 million Americans who are jobless due to the crisis.",1
