text,bias,bias_BABESG2,objective_BABESG2,partly-subjective_BABESG2,subjective_BABESG2,nonpartisan_headline,slight-partisan_headline,hyperpartisan_headline,nonpartisan_article,slight-partisan_article,hyperpartisan_article,true_LIAR,mostly-true_LIAR,half-true_LIAR,barely-true_LIAR,false_LIAR,pants-fire_LIAR,bluff_FakeNewsTFG,negative_NewsMTSC,neutral_NewsMTSC,positive_NewsMTSC
"Fauci has consistently done media interviews with a range of outlets, which has annoyed the president, this person said.",0,0.11239771,0.99742776,0.0020856012,0.00048669678,0.99601847,0.0035207476,0.000460844,0.15570332,0.6691283,0.1751684,0.060918268,0.12172143,0.6686466,0.0331275,0.111294895,0.004291345,0.00463424,0.9965412,0.0031727902,0.00028598838
"The euro may be in its death throes, as the new ECB president, Christine Lagarde, has proved herself unready for prime time.",1,0.7637633,0.0019919677,0.21604851,0.78195953,0.012277419,0.94592834,0.041794263,0.61713874,0.06622121,0.31664,0.025754,0.054048173,0.39382425,0.114214964,0.40612552,0.006033156,0.014898964,0.9922848,0.0009372359,0.006777961
"In recent months, Trump has begun aggressively attacking mail voting, a process that is standard in some states now and which many others are expanding because of concerns that in-person voting could spread the coronavirus. Trump has repeatedly claimed that expanding voting by mail will let Democrats cheat, even though he, his press secretary and a top adviser have all voted by mail in recent elections.",1,0.84896284,0.07042514,0.9236499,0.005924955,0.01665411,0.5909747,0.39237115,0.0012576923,0.0026889553,0.99605334,0.015390038,0.05928739,0.8758575,0.03315724,0.009212293,0.0070956154,0.00028224493,0.99858993,0.00085821236,0.0005519309
"Critics of the federal refugee resettlement program warn that, if elected, Hillary Clinton will flood the country with Muslim refugees.",1,0.5406218,0.99683493,0.0027486545,0.00041633056,0.00022173935,0.9996302,0.00014808247,0.018152663,0.5204879,0.46135938,0.006695352,0.009059195,0.1013237,0.51670784,0.3544737,0.011740188,0.00025884982,0.9978986,0.0011339167,0.00096745195
Trump is already bungling the coronavirus response — and it could get much worse,1,0.9557588,0.00082572375,0.047883775,0.9512905,0.6492423,0.009256963,0.34150067,0.001518441,0.0014494082,0.99703205,0.008652146,0.011168176,0.07099946,0.5430349,0.35032207,0.015823226,0.15540363,0.9976428,0.0014167867,0.00094039313
"Trump and his team have confronted years of questions about their competence and ability to tackle routine governmental tasks. Occasionally, those concerns are especially acute.",1,0.2590123,0.029233776,0.9651288,0.0056374515,0.005066504,0.59776396,0.3971695,0.0029859268,0.0075227367,0.98949134,0.04638928,0.22088887,0.7027548,0.01661334,0.007880503,0.0054732603,0.00056220277,0.33702588,0.0038588368,0.6591152
"As widespread protests over racial injustice roiled the country, LGBT+ campaigners on Monday, the start of the annual Pride month, called for a return to the rebellious origins of the U.S. gay rights movement.",0,0.08688332,0.996994,0.0023959181,0.00061003084,0.9919076,0.006956962,0.0011354919,0.013642563,0.3091323,0.6772251,0.007815371,0.00988876,0.106887534,0.39374647,0.47298247,0.008679408,0.00041494778,0.99701273,0.0018252177,0.0011620779
"She’s among four dozen or so people gathered outside on a hot late-summer morning, joining a hard core of activists who believe that all vaccines are dangerous and who have become increasingly emboldened about denouncing the medical establishment.",0,0.11843453,0.9555279,0.043851744,0.0006202881,0.0026543927,0.99134845,0.0059971916,0.0027129112,0.117086664,0.88020045,0.02346774,0.037498076,0.31253496,0.26178718,0.3563716,0.008340381,0.39071563,0.0052831783,0.010609367,0.9841075
"Civil rights activists across the United States for years have called for scaling back traditional policing, and the efforts have gained momentum through protests over the death of George Floyd in Minneapolis police custody last month.",0,0.07790163,0.99756986,0.0018610053,0.0005691513,0.00093068526,0.9976943,0.0013750112,0.04616154,0.8183441,0.13549435,0.02726398,0.0651216,0.85957235,0.02470703,0.018012136,0.0053228564,0.0009010526,0.9332959,0.003666384,0.06303773
"WHO is working to ensure fair vaccine distribution, but in the meantime it is key to suppress the virus’s spread, said Mike Ryan, head of WHO’s emergencies program, as daily new cases around the globe are at near-record levels.",0,0.093817055,0.9967733,0.002572225,0.0006544761,0.9384231,0.061042454,0.0005344819,0.9411754,0.05684279,0.0019818433,0.009725465,0.041732345,0.5658102,0.23729542,0.13769281,0.007743716,0.10430201,0.00092540664,0.021551961,0.9775227
"The New York Times recently published a fairly detailed fact-check of these Trump World arguments that democrats don’t mind executing babies after birth, and not surprisingly, the rhetoric is irresponsibly wrong.",1,0.95052075,0.0042085606,0.86796194,0.12782954,0.001958628,0.0067378976,0.99130356,0.00051066116,0.0005548854,0.99893445,0.039466932,0.045684937,0.52226496,0.061090384,0.3267734,0.0047193617,0.1838851,0.9979832,0.0015245308,0.00049214665
"Memories of smashed windows, stolen merchandise and stores set ablaze is fresh in the minds of business owners in major U.S. cities including New York, Los Angeles and Portland, where aggressors damaged buildings under the cover of peaceful demonstrations sparked by the May 25 police killing of George Floyd, a Black man.",1,0.11444443,0.9962794,0.0027017407,0.0010188817,0.97241545,0.027009357,0.0005751969,0.0055218274,0.94930685,0.045171287,0.016229322,0.050939582,0.7805914,0.08731879,0.05940889,0.0055119703,0.0003865512,0.9960522,0.0024695634,0.0014782842
"Furthermore, the president has repeatedly and infamously made sweeping, overtly bigoted comments about minority populations",1,0.9465789,0.010434377,0.97480655,0.014759066,0.0009892704,0.1545724,0.8444383,0.0009477466,0.005742166,0.9933101,0.04794875,0.13139671,0.76942986,0.019139303,0.028064352,0.00402106,0.013897582,0.9982845,0.0006461543,0.0010693118
Anti-vaccine groups take dangerous online harassment into the real world,0,0.60029554,0.015112088,0.962715,0.022172885,0.009875678,0.6286053,0.36151907,0.010155819,0.008584026,0.9812602,0.009244098,0.010013119,0.058101818,0.52177984,0.38685378,0.014007353,0.0029908589,0.99768686,0.0014819395,0.0008312649
"Abortion ends lives, hurting women and preborn children.",0,0.11712947,0.0007824573,0.0088730985,0.99034435,0.00020624322,0.99964774,0.00014602243,0.088965535,0.75999314,0.15104131,0.00805408,0.024422474,0.27727398,0.50035,0.17355317,0.016346373,0.031679012,0.9968532,0.0017795308,0.0013672805
"The problem, Ocasio-Cortez complained, wasn’t that the cost of the college was prohibitively high but that the student was not offered any large discount in the form of scholarships.",0,0.14831145,0.99442446,0.0052566235,0.00031887682,0.03500362,0.9176213,0.047375016,0.051053945,0.8024521,0.14649397,0.013164854,0.032199748,0.33864963,0.16883567,0.44212717,0.0050229123,0.2667538,0.9187055,0.07938849,0.0019060262
"Global cooperation is key to ensuring the security of 5G networks, cyber security officials said on Thursday at a meeting in Prague aimed at hammering out how to combat threats as nations begin rolling out next-generation telecoms equipment.",0,0.0665838,0.99627703,0.0027351957,0.0009877676,0.99851614,0.0012210861,0.00026286376,0.99655896,0.0030253767,0.00041573608,0.012035644,0.060058504,0.61900645,0.15378693,0.14650665,0.0086058555,0.00026938203,0.000984145,0.008854589,0.9901612
"Despite police officers in several parts of the country joining peaceful protests against police brutality, far-left agitators engaged in round-the-clock destruction of businesses and residences, including the burning down of an affordable housing complex in Minneapolis.",0,0.16391149,0.15422052,0.84094316,0.004836345,0.0010860409,0.9887709,0.010142999,0.0039118845,0.03880712,0.95728093,0.009174906,0.016280964,0.23662211,0.5167063,0.20953174,0.011683953,0.0003598545,0.99719393,0.0014251133,0.0013810209
"U.S. Democratic presidential candidate Joe Biden would use taxes on the wealthy and corporations to pay for $3.2 trillion in promised investment in infrastructure, higher education and healthcare, according to an outline of his plans if he captures the White House.",0,0.10946009,0.99505377,0.0032327427,0.001713513,0.9997192,0.00020309413,7.7670724e-05,0.8360105,0.029103026,0.13488641,0.008601332,0.024000159,0.41222602,0.4301623,0.11172555,0.013284666,0.00023339028,0.9903717,0.0019309166,0.0076973815
Rep. Luis Gutierrez (D-IL) whined about Breitbart News’ coverage of illegal immigrants and Muslim refugees during his recent commencement address at Cambridge College.,1,0.94819283,0.05371458,0.9388744,0.0074110785,0.0036843433,0.5140502,0.48226544,0.00097598636,0.0009912613,0.99803275,0.008404743,0.008169439,0.0792864,0.412483,0.4826268,0.009029662,0.016232809,0.99809986,0.001516504,0.00038361782
"Firearm sales surged anew in 2020 due to fears related to the pandemic, and following social unrest in several U.S. cities and calls to defund police departments.",0,0.09379951,0.9975561,0.0019673659,0.00047650002,0.99967444,0.00017505656,0.00015051577,0.998126,0.0010709395,0.000803017,0.01164477,0.038264148,0.9001068,0.034346715,0.010889989,0.0047475854,0.0002687046,0.9938205,0.0046162447,0.0015632911
"There were many reasons that Trump defeated Clinton in 2016, and sexism was surely among them. ",1,0.9326576,0.0008164702,0.0054454557,0.99373806,0.0055384478,0.061703604,0.93275803,0.0008628987,0.0012045727,0.99793243,0.059433278,0.34650537,0.56489295,0.012838823,0.013060808,0.0032688114,0.00033061006,0.9980282,0.0014401358,0.00053152966
The protests in London come days after Black Lives Matter and Antifa flooded the streets of the British capital over the weekend — with little to no regard for the government-mandated social distancing — calling “to burn this shit down” and hailing the chaos and riots in America as a sign that the “West is Falling”.,1,0.90468144,0.017936913,0.9769594,0.0051037623,0.0015374833,0.018278094,0.9801845,0.0004153816,0.0009410142,0.9986436,0.009951178,0.023616211,0.2424215,0.32618973,0.39068428,0.0071371077,0.6474965,0.99559045,0.0030591446,0.0013503501
"Ocasio-Cortez, who advocates for democratic socialism, is not the only Democrat in Washington, D.C., honing in on billionaires these days.",0,0.15370685,0.0062400326,0.9503941,0.043365892,0.20454927,0.79382783,0.0016229172,0.28779295,0.096677534,0.61552954,0.0151283145,0.026956875,0.18127982,0.38460174,0.38396892,0.008064334,0.0006134049,0.0016907133,0.0006708845,0.99763846
"Utah barred abortion after 18 weeks last year, becoming one of several states to adopt strict bans. ",0,0.09093991,0.9971782,0.0022934221,0.0005283596,0.00022770431,0.9996939,7.850713e-05,0.02255078,0.9684737,0.008975605,0.021025876,0.040748484,0.5025213,0.1432775,0.28865308,0.0037736949,0.00026055734,0.968476,0.030632017,0.0008919513
"Home Secretary Priti Patel said that in response to the surge of illegal migrants, the government will look into how to speed up the deportation process, possibly to be modelled on Australia’s uncompromising system which saw a steep decline in illegal migration under the Commonwealth’s “stop the boats” policy.",0,0.13212344,0.9952886,0.0042238412,0.0004874975,0.94804615,0.049570944,0.0023829592,0.019879203,0.106934875,0.873186,0.00662887,0.011639405,0.19453152,0.39177415,0.38804623,0.0073797717,0.005760233,0.00081466587,0.99429333,0.0048920223
"Peace was one of many transgender service members who spoke out against Trump after he announced on Twitter in July 2017 that the military would no longer allow transgender individuals ""to serve in any capacity."" ",0,0.08537505,0.9969375,0.0026112038,0.0004512352,0.0028701723,0.9372143,0.05991551,0.009807671,0.6568729,0.33331943,0.07384858,0.022118784,0.20351487,0.07600763,0.6148987,0.009611404,0.0005219785,0.9979539,0.0015850294,0.00046105238
"The Obama-era memoranda directed the FSA to shift its focus from collecting student debt to assisting student borrowers in debt management, even to the extent of allowing them to default on their loans. ",0,0.10039333,0.88445824,0.11494802,0.0005937427,0.2256883,0.7673619,0.006949844,0.06824173,0.24231517,0.6894432,0.01066319,0.012425982,0.16247611,0.5709303,0.2233863,0.020118164,0.0066634403,0.7615073,0.05064831,0.18784443
"Donald Trump, the latest political demagogue to employ the term as a rhetorical bludgeon against peaceful protesters, can look forward to sitting alongside Sen. Joseph McCarthy, former Alabama Gov. George Wallace, Chicago Mayor Richard J. Daley, who ordered police to attack political demonstrators at the 1968 Democratic convention, Richard Nixon and many foreign dictators in the annals of history — and if there is an afterlife, in the middle of the inferno.",1,0.9555391,0.0018592679,0.25897372,0.73916703,0.00011777289,0.99913496,0.0007472645,0.0013409994,0.0008551166,0.99780387,0.016620714,0.07718497,0.81855124,0.053478237,0.028619958,0.0055448944,0.31339455,0.9979836,0.001186244,0.0008301086
"Even as U.S. immigration officials have pushed to deport hundreds of Iraqi Christians over the last few years, asserting in court that they are unlikely to be targeted in their homeland, another arm of the Trump administration has insisted just the opposite, saying that Christians in Iraq face terror and extortion.",1,0.81014925,0.97448915,0.025204424,0.00030643734,0.007960991,0.8706558,0.12138331,0.012773547,0.40976912,0.5774573,0.02263243,0.10868809,0.82417935,0.026198072,0.010074547,0.008227445,0.0002609924,0.99778277,0.001430637,0.000786589
"There is a growing push within the Trump administration to craft a list of retaliatory measures against China over its role in the coronavirus outbreak, three sources, including a U.S. official, familiar with the matter said, but cautioned the efforts were in early stages.",0,0.10546808,0.99736893,0.0021262972,0.00050472835,0.9994562,0.00023525162,0.0003084722,0.9300648,0.056114104,0.013821115,0.013336304,0.056236427,0.68583095,0.11370259,0.1249887,0.0059050526,0.0002676527,0.9859747,0.013776505,0.00024872881
"Witness, for instance, the wacky nonsense New York mayor and current Trump flunky Rudy Giuliani addressed to Salon's Roger Sollenberger during a text interview this week. ",1,0.9569899,0.0105391545,0.96397305,0.025487859,0.17069899,0.80791086,0.021390196,0.004655476,0.0032421458,0.9921023,0.092101164,0.058235027,0.18314353,0.04015353,0.61799425,0.008372492,0.027619043,0.99827206,0.0012866438,0.00044128465
"As for Joe Biden, he’s made some truly bizarre comments about guns over his long political career, driven more by a desire to appease both gun-control advocates and gun-owning Democrat constituencies than any coherent philosophy.",1,0.95775473,0.0010934222,0.04182312,0.9570834,0.00093659724,0.83348423,0.1655792,0.0002695843,0.00086049025,0.99886996,0.031911287,0.118685625,0.7984043,0.02921761,0.018082248,0.003698945,0.043379076,0.9985688,0.000620743,0.00081037136
"The number of abortions performed in 2017-2018 was 11,373 more than the abortions performed the year before that, a trend that shows that while Planned Parenthood officials once said abortion should be “safe, legal, and rare,” today they omit the word “rare” in their mantra as they perform more abortions each year.",0,0.18170145,0.0066160522,0.97568864,0.017695362,0.001714471,0.99355376,0.004731784,0.00062861183,0.00066244625,0.99870896,0.07601493,0.35837567,0.54770005,0.009754278,0.005619935,0.0025350691,0.43761086,0.07953501,0.9144062,0.0060587735
"There is no doubt that discrimination plays a role in this wage gap, but there are other factors that deserve attention.",0,0.10315566,0.00057577615,0.007844652,0.99157953,0.0019292596,0.9922231,0.0058477297,0.5153564,0.29704198,0.18760155,0.06214241,0.68147874,0.23748831,0.007125362,0.008829392,0.0029357746,0.23036465,0.97946507,0.0028183584,0.017716566
"The Guardian, insisting that the climate emergency is “the defining issue of our times,” has amped up its climate agitation by suggesting that Australian wildfires is the new normal.
",0,0.34877145,0.019669173,0.9738582,0.006472669,0.0030759503,0.10934167,0.8875824,0.00063789694,0.00086698314,0.9984951,0.010356757,0.030366194,0.5447138,0.23564193,0.17110804,0.007813291,0.101203226,0.9982029,0.0010010748,0.00079592055
"Sen. Bernie Sanders (I-Vt.) was among those who suggested Wednesday that a Medicare for All system—falsely dismissed by Republicans and corporate Democrats as prohibitively expensive and unrealistic—could afford all Americans the ability to see a doctor if they develop the flu-like symptoms associated with coronavirus, officially known as COVID-19.",1,0.90363693,0.018542057,0.97452,0.0069378642,0.056985695,0.79317623,0.14983813,0.00056342804,0.0007991781,0.9986374,0.006485285,0.0068470044,0.074091114,0.42575654,0.47810057,0.00871948,0.2407516,0.997387,0.0019991922,0.00061388034
"The case of Rahaf Mohammed al-Qunun drawn new global attention to Saudi Arabia’s strict social rules, including a requirement that women have the permission of a male “guardian” to travel, which rights groups say can trap women and girls as prisoners of abusive families.",0,0.12259774,0.99068147,0.008831383,0.00048718514,0.040555425,0.85236925,0.107075304,0.031417686,0.76663965,0.20194268,0.008578252,0.017373566,0.32633427,0.36227074,0.27760494,0.007838283,0.004557708,0.997591,0.0015529988,0.0008560242
Even a member of French President Emmanuel Macron’s La République en Marche! (LREM/Republic on the Move) slammed the sports hijab.,1,0.95846814,0.026057217,0.95748276,0.016460001,0.001217379,0.9909444,0.007838174,0.0022036997,0.0038495616,0.99394673,0.033045575,0.027699577,0.14681391,0.08641718,0.6997772,0.006246522,0.6276201,0.998103,0.0012982995,0.0005985452
"Though conservatives try to demonize Ocasio-Cortez an Omar, their actual policy views are perfectly mainstream.  The New York lawmaker proposed a 70 percent tax on top incomes — a view backed by public opinion and many well-respected economists.",1,0.81418693,0.3226739,0.67578727,0.0015388328,0.023661174,0.11025124,0.86608756,0.0035557912,0.0069216574,0.9895225,0.01812151,0.11802148,0.780753,0.050733652,0.027017938,0.0053523905,0.0039500045,0.99395776,0.0038130188,0.0022292407
Six Republican Senators have failed to develop a coalition for their plan that exchanges a fifth of border wall funding for an amnesty for illegal aliens and increased immigration.,1,0.27255377,0.99479324,0.0048749708,0.00033177453,0.0002846441,0.997329,0.0023863688,0.050132364,0.25314143,0.69672626,0.19914973,0.42519933,0.34782076,0.009896688,0.015574949,0.0023585986,0.00026137516,0.99772304,0.0013691421,0.0009078892
"While President Trump visited the southern border Thursday, Democratic darling Beto O’Rourke visited the dentist — posting a bizarre video showing him getting a mouth-wide-open cleaning in order to highlight the story of his dental hygienist’s upbringing in El Paso.",1,0.8755818,0.03594944,0.95838296,0.005667602,0.0034762777,0.99628913,0.0002346388,0.00092510873,0.011414765,0.9876602,0.018663581,0.014307491,0.1165249,0.5394742,0.28549063,0.025539162,0.10817922,0.9962555,0.0028333038,0.00091109035
"In an apparent attempt to blame sexism for the blowback the Rashida Tlaib received for her ""Impeach the Motherf*cker"" remark, Pelosi wondered aloud what the response would have been if a man made the same comment. ",1,0.7585111,0.027879301,0.9423919,0.029728856,0.0020459765,0.004487067,0.9934669,0.002359912,0.002711816,0.99492836,0.013948529,0.010387457,0.098486274,0.19529259,0.6754276,0.0064574345,0.23546864,0.99608046,0.0031539355,0.0007656027
"On Wednesday, democrats got a chance to grill President Donald Trump's point person on deregulation as Andrew Wheeler came to Capitol Hill for his confirmation hearing to be the next permanent administrator of the Environmental Protection Agency.",1,0.9391155,0.99011797,0.009508214,0.00037378274,0.013775679,0.98468417,0.0015401273,0.00869975,0.0064337314,0.98486656,0.013243738,0.012843478,0.1046225,0.3708242,0.49044147,0.008024594,0.007609761,0.034495514,0.9573515,0.008152961
"European states are trying to accelerate a plan to shift thousands of foreign Islamic State militants out of Syrian prison camps and into Iraq, as a fresh conflict in Syria has raised the risk of jihadists escaping or returning home.",0,0.11743556,0.9964677,0.0028151807,0.00071707973,0.1623043,0.7417277,0.09596804,0.23233783,0.6254383,0.14222395,0.011310104,0.0457033,0.6253978,0.17340904,0.13535222,0.008827533,0.00025297323,0.99196374,0.006238494,0.0017977796
"Stephanie Robinson, 23, a rookie Black police officer on Detroit’s West Side, has been challenged by Black residents about her loyalty while on patrol since the death of George Floyd under the knee of a white police officer.",0,0.07298059,0.9966587,0.0028012535,0.0005401385,0.00018666545,0.9996038,0.00020957837,0.0013829732,0.99726605,0.0013509392,0.00977632,0.009384686,0.10253758,0.47374293,0.3942908,0.0102676675,0.001905937,0.9940562,0.0008399596,0.0051038694
"Britain’s parliament has rebranded itself with possibly the wokest logo evah: a rainbow flag which invokes simultaneously the racial harmony of South Africa, the quiet dignity of Black Lives Matter, the modest restraint of the transgender movement, the subtlety of LGBTQ and the scientific and economic integrity of the green movement – all in one multicoloured vomiting splurge of rainbow-hued diversity.",1,0.9630171,0.0013730256,0.0762721,0.92235494,0.004505041,0.66386276,0.3316322,0.0016549005,0.0020801292,0.996265,0.048376024,0.22345637,0.6464924,0.024835354,0.053532023,0.0033077877,0.23363483,0.9462791,0.0027568797,0.05096403
The Trump administration shelved a document created by the nation's top disease investigators with step-by-step advice to local authorities on how and when to reopen restaurants and other public places during the still-raging coronavirus outbreak,0,0.18593854,0.99347067,0.0059565785,0.0005727304,0.514171,0.13477758,0.35105142,0.0036586178,0.25230268,0.7440387,0.0076229526,0.009310414,0.13787307,0.4595857,0.37510628,0.010501618,0.0002719419,0.9639347,0.03499917,0.0010660979
"Texas Gov. Greg Abbott on Friday became the first governor in the country to refuse to take in refugees, but 18 of his 26 Republican counterparts have chosen to open the door to refugees, much to the surprise of the Trump administration.",0,0.08875994,0.99665254,0.0029234441,0.00042397596,0.00024485207,0.9993443,0.0004108004,0.21606377,0.61271554,0.17122069,0.030009067,0.04076969,0.78925705,0.059186023,0.076755196,0.004023025,0.00025691994,0.9898694,0.0023552752,0.007775229
LGBTQ health experts said Always's decision to remove the female signs from its products is an ostensibly small change that may have significant consequences for trans and nonbinary people.,0,0.11366788,0.997581,0.0020012313,0.00041775662,0.15662093,0.83598065,0.00739834,0.87307113,0.124274,0.0026548204,0.009139026,0.019320466,0.28175384,0.18579963,0.49894017,0.0050469106,0.0060579814,0.016137019,0.9823628,0.0015002296
"Naturally, of course, right-wingers reacted in the ugliest way possible: By arguing that Thunberg’s identity — as a young person, as a person on the autism spectrum and, although they are careful not to say this directly, as a girl — inherently discredits what she has to say.",1,0.96301347,0.0009093869,0.06541348,0.9336772,0.0021008998,0.014661504,0.9832376,0.001508339,0.001743293,0.9967483,0.007878003,0.022551317,0.28535202,0.35897407,0.3173189,0.007925718,0.15094747,0.9982279,0.0010113772,0.0007608016
"The picture that emerges is of a system of staggering complexity, riddled with obstacles and cracks, that prioritizes babies over mothers, thwarts women at every turn, frustrates doctors and midwives, and incentivizes substandard care.",0,0.92559326,0.0006328381,0.004612372,0.9947548,0.0014122273,0.9844749,0.014112868,0.08041814,0.2801147,0.6394671,0.008260121,0.018690024,0.22102448,0.4909035,0.24823382,0.0128879445,0.30413553,0.9971264,0.0009296265,0.0019440054
"Floyd’s death has added to the disquiet among Black residents in Tulsa, which saw its own demonstrations in 2017 after a white police officer was acquitted of manslaughter for shooting a Black man during a routine traffic stop.",0,0.07791049,0.9977768,0.0017271739,0.00049605226,0.00040484825,0.99710566,0.0024894592,0.0019046864,0.9498811,0.04821423,0.076371014,0.17135936,0.71898735,0.013301985,0.015335679,0.0046446547,0.00073681003,0.99758124,0.0019848326,0.0004339099
"On top of the enormous financial impact, these beauty regimens require these women to take the time out of their busy schedules to attend to their appearances in a way that men in power are spared. ",0,0.11746703,0.0006063766,0.0048345067,0.9945591,0.18530776,0.58128613,0.23340611,0.24996777,0.42378306,0.3262492,0.016590394,0.12131295,0.7939188,0.03629364,0.027295794,0.00458841,0.30769354,0.37359005,0.008388332,0.6180216
A Texas law requires contractors who work for or do business with the state to certify that they do not boycott Israel or Israeli-occupied territories.,0,0.085432075,0.9961163,0.0030980185,0.0007857839,0.00056262227,0.9989115,0.0005259334,0.037012827,0.4792101,0.48377705,0.3534237,0.23189338,0.22377552,0.02317785,0.15787427,0.009855294,0.00027614657,0.053461116,0.93043363,0.016105285
"The coronavirus pandemic, enabled and accelerated by Donald Trump, has killed more than 60,000 Americans. ",1,0.27485967,0.9971119,0.0023657568,0.00052227016,0.00015501813,0.9995179,0.00032712318,0.0023845448,0.0015328657,0.99608254,0.008346439,0.018540295,0.32033372,0.4674665,0.17306788,0.012245193,0.0020960416,0.99257576,0.006000649,0.0014235845
