text,bias,bias_BABESG2,objective_BABESG2,partly-subjective_BABESG2,subjective_BABESG2,nonpartisan_headline,slight-partisan_headline,hyperpartisan_headline,nonpartisan_article,slight-partisan_article,hyperpartisan_article,true_LIAR,mostly-true_LIAR,half-true_LIAR,barely-true_LIAR,false_LIAR,pants-fire_LIAR,bluff_FakeNewsTFG,negative_NewsMTSC,neutral_NewsMTSC,positive_NewsMTSC
"Indeed, as an aside, one wonders what Obama’s vice president, Joe Biden, thinks of all this: Has he learned the lesson of Iraq and other quagmires?  Has he rethought trade with China? Those are certainly good questions to be answered during the remainder of the 2020 campaign season.  ",0,0.52835286,0.0014520136,0.10769755,0.89085037,0.00022861508,0.9980171,0.0017542809,0.0018400337,0.03397804,0.9641819,0.05028988,0.1778664,0.6233664,0.042719778,0.10229093,0.00346655,0.06854159,0.75086915,0.017504893,0.23162594
The number of April background checks to purchase a firearm showed Americans flocking to gun stores in high numbers for the second month in a row amid worries about the coronavirus pandemic.,1,0.18965778,0.7290708,0.26942047,0.0015087455,0.18839651,0.8107536,0.0008499351,0.28602844,0.44107854,0.27289304,0.012788214,0.03965539,0.7284831,0.15220556,0.060338855,0.0065288558,0.00025105797,0.17816027,0.13148676,0.69035304
"It's perverse that any other governor would follow Abbott's lead, for he presides over a health care disaster.",1,0.867682,0.00053952605,0.0050881086,0.99437237,0.0030696245,0.38643056,0.6104998,0.023428,0.08340529,0.8931668,0.225349,0.10478845,0.15300725,0.05112936,0.45921192,0.006514026,0.0024250157,0.998059,0.0012488075,0.00069223414
"Donald Trump claimed he has seen evidence the new coronavirus originated in a Chinese lab, as he threatened tariffs on Beijing over its role in the global pandemic.",1,0.5691792,0.9976109,0.0018922474,0.0004968371,0.00997456,0.9842651,0.005760373,0.20197156,0.015878022,0.78215045,0.19931445,0.37402254,0.3860595,0.011877828,0.020618256,0.008107499,0.00024809758,0.99679226,0.0027240363,0.0004837591
The Times reported that Bill Gates had met in with Epstein multiple times ,0,0.11862947,0.99710256,0.0022519573,0.0006454212,0.9548101,0.014838681,0.030351235,0.003287707,0.0028605908,0.99385166,0.19042826,0.13177924,0.45347053,0.036424063,0.18130484,0.0065931077,0.0033274433,0.0015368868,0.99721473,0.0012484331
"We just survived eight years of a messianic presidency, with a finger-wagging, patriotism-appropriating administration lecturing us on how to be proper Americans.",1,0.9677127,0.00068144564,0.0031460363,0.9961726,0.0011493204,0.80158365,0.19726701,0.0020914034,0.003662874,0.9942458,0.011421965,0.020921836,0.2780638,0.41181043,0.26838493,0.009397061,0.34440118,0.003743179,0.00045332694,0.99580353
"But make no mistake about it: Despite receiving widespread positive attention from many in the press, Ocasio-Cortez’s radical left-wing policy proposals and her socialist ideology present a significant threat to America’s economy and its longstanding commitment to individual liberty. ",1,0.8966867,0.0035043133,0.2679699,0.7285259,0.001957756,0.0057417564,0.9923005,0.00037897332,0.008854092,0.9907669,0.016619932,0.13070454,0.7528048,0.060713142,0.03190937,0.0072481567,0.110149466,0.9908717,0.00087941764,0.008248897
"Meanwhile, Britain’s police forces are notorious for focusing on matters of policing hate speech rather than violent crime, particularly with regard to Muslim grooming gangs.",1,0.4568651,0.025186053,0.9667633,0.008050669,0.0011001793,0.9939885,0.0049112774,0.016471578,0.022661362,0.9608671,0.16038382,0.6324509,0.17584898,0.008705851,0.018180873,0.00442963,0.0016029977,0.9983808,0.00082788884,0.0007913531
"Other than the fact that none of the above is even close to the truth and that the entire premise of the article is the fakest of fake news, the Daily Beast has a real bombshell on its hands.",1,0.9429707,0.0006835002,0.0036902463,0.9956262,0.0157914,0.24156106,0.7426476,0.004278639,0.0054343464,0.99028695,0.051050417,0.049468465,0.21639918,0.0720191,0.6060168,0.0050460426,0.3995258,0.99801207,0.0011201962,0.00086770457
"Abortion propaganda was always meant to obscure the reality of abortion, not justify it.",1,0.9209006,0.0011719672,0.0040770103,0.99475104,0.0027753585,0.919971,0.07725372,0.011017706,0.009575997,0.9794063,0.019721186,0.019587744,0.068030395,0.050755545,0.8379416,0.003963644,0.044877205,0.99587893,0.0024757574,0.0016453469
Twitter Boss Finds the Balls to Call Out Trump’s Race-War Tweet,1,0.89855003,0.00068344316,0.014354967,0.9849615,3.5209618e-05,2.4770603e-05,0.99994004,0.0012718544,0.0033438345,0.9953843,0.006825301,0.011847092,0.1080109,0.2454242,0.621108,0.0067844777,0.999571,0.74141973,0.25729778,0.0012824561
"The U.S. Supreme Court on Friday temporarily prevented a Louisiana law imposing strict regulations on abortion clinics from taking effect in a case that presents a key test on the contentious issue following last year’s retirement of Justice Anthony Kennedy, a pivotal supporter of abortion rights.",0,0.06838464,0.9962608,0.0032001412,0.00053911866,0.15981369,0.837387,0.002799334,0.0051781456,0.042640276,0.9521815,0.010406701,0.011325667,0.2144548,0.28542686,0.47225228,0.006133647,0.00038749643,0.9685707,0.025270617,0.0061586886
"People who choose not to vaccinate has emerged into a global health threat in 2019, said the World Health Organization.",0,0.08753186,0.99692756,0.0021142284,0.0009582517,0.9711549,0.02868137,0.00016366833,0.9858892,0.010931689,0.0031790521,0.01116499,0.023026448,0.31671542,0.14359814,0.50087905,0.0046159113,0.009990765,0.37987933,0.6094253,0.010695355
"Since the migration crisis erupted in 2015, mainly fuelled by the war in Syria, Greece has granted asylum to around 40,000 people, Mitarachi said.",0,0.111796565,0.99782676,0.0016355166,0.00053762016,0.63684547,0.36185026,0.0013042424,0.4008749,0.5751811,0.023944028,0.13439025,0.18792109,0.6457234,0.012260219,0.016747855,0.002957142,0.0002869933,0.0010934937,0.99569774,0.0032087334
CNN national correspondent John King ripped President Donald Trump for not mentioning climate change in his second State of the Union address.,1,0.9408761,0.028347675,0.9550157,0.016636599,0.00033568253,0.9992385,0.00042582056,0.0152833,0.014369179,0.9703475,0.0196571,0.016409788,0.15394026,0.098289534,0.70340794,0.008295386,0.0006955807,0.99800843,0.0012636923,0.00072789023
"Trump’s Latest Dose of Anti-Trans Poison Is Cruel, and Utterly Predictable",1,0.94212526,0.0013588452,0.0049650054,0.9936761,2.7199836e-05,2.539049e-05,0.9999474,0.001193741,0.00055319804,0.99825305,0.0054373574,0.0068596504,0.060516216,0.2681545,0.6523081,0.0067241504,0.9997143,0.9982998,0.0010733976,0.0006267916
"A 16-time NBA All Star who is considered one of the greatest basketball players of all time, James, 35, reacted angrily this week to the shooting of Blake in Kenosha, Wisconsin, which sparked days of civil unrest.",0,0.07676537,0.99699104,0.0024963703,0.00051265984,0.00024142211,0.9996191,0.00013943926,0.0220433,0.97193426,0.0060224207,0.010495478,0.012815945,0.15501197,0.36045593,0.45383573,0.0073850015,0.0007437921,0.99742305,0.0011870218,0.0013899235
"These [policies] include creating collective ownership in black communities, instituting reparations including for illegal aliens, defunding the police, and “disrupt[ing] the Western-prescribed nuclear family structure.”",1,0.9091497,0.0006372823,0.010071479,0.98929125,0.002385944,0.17930165,0.8183124,0.0004367364,0.009702916,0.98986036,0.013769496,0.027257454,0.45629433,0.18180363,0.3113882,0.009486886,0.22814989,0.99819714,0.00078418414,0.0010187286
"According to Lauren Copeland (a political science professor at Baldwin Wallace University in Ohio and another person who worked on the Great Lakes Poll), public support for Obamacare has continued to grow.",0,0.08745949,0.99553066,0.0036083434,0.0008609788,0.027278582,0.80672455,0.16599691,0.0012960291,0.002525581,0.9961784,0.014249677,0.045121,0.8669687,0.04731519,0.02183554,0.004509906,0.0044613513,0.0008019632,0.01743687,0.9817613
"Monday for his show’s opening monologue, Fox News Channel’s Tucker Carlson gave a scathing criticism of the Black Lives Matter Movement for the violent tactics it has used to rise to power and questioned many Republicans for their unwillingness to stand up to oppose those tactics.",1,0.7268637,0.031214984,0.96554637,0.0032386843,0.006226461,0.9782566,0.015516921,0.0003831097,0.0007562231,0.9988607,0.013814742,0.015016083,0.16469678,0.44597107,0.34577578,0.014725497,0.13952263,0.9983923,0.0008065942,0.00080110034
The gun safety group Giffords will launch a nationwide effort next week aimed at boosting Democratic candidates in key U.S. Senate races who support universal background checks for firearms purchases.,0,0.10743908,0.9963552,0.002967496,0.0006774083,0.99952614,0.0003139887,0.00015984874,0.994166,0.003819223,0.0020147823,0.006995686,0.011724846,0.15581553,0.5303448,0.28531536,0.009803846,0.00025257654,0.0006368172,0.00036078942,0.9990024
"During July’s debate, Sanders again stated that people will “pay more in taxes” but claimed that it would result in “less” spent on health care.",1,0.4634585,0.9939824,0.005683167,0.0003344953,0.5512083,0.42812788,0.020663807,0.083332844,0.13740472,0.7792624,0.015338763,0.016359322,0.15112622,0.58524334,0.20094267,0.03098964,0.005512253,0.002157731,0.99462104,0.0032212
"Appearing on CNN early Saturday morning national security expert Juliette Kayyem expressed frustration with Donald Trump after watching a clip of his contentious press conference from Friday, saying he is still not doing enough to contain the coronavirus pandemic spread.",0,0.097748004,0.99217683,0.0074197375,0.00040348317,0.8369969,0.16277365,0.00022951361,0.00072363904,0.004104588,0.9951717,0.012035108,0.01270076,0.24142161,0.24340302,0.4803113,0.01012821,0.009530512,0.9980217,0.0013426756,0.0006356135
"However, Democrats, including some of the 2020 candidates, have continued to push a narrative that Trump called white supremacists “very fine people,” when he clearly did not.",0,0.27753067,0.021718815,0.974082,0.0041991724,0.0025186904,0.048331518,0.94914985,0.00041146582,0.0007213163,0.99886715,0.033901513,0.11990931,0.794747,0.025709461,0.01571779,0.010014894,0.00028056194,0.99837375,0.00090283196,0.000723432
The measures include a ban on Islamic headscarves for girls until they reach the age of 14 and a provision for putting potentially dangerous individuals in “protective custody” to prevent them from committing violent actions.,0,0.13945368,0.99337924,0.0055370796,0.0010836682,0.0032536762,0.9919458,0.0048004524,0.110640995,0.33773595,0.55162305,0.01052283,0.031194756,0.47985953,0.20612897,0.26610073,0.0061931834,0.0036836434,0.98858845,0.008114862,0.0032967073
"At this point — and keep in mind this is the open discussion part of the debate — after Biden had his say, Trump jumped in and Biden became outright obnoxious and  started interrupting Trump constantly",1,0.9405863,0.015302768,0.9543457,0.030351559,0.009073231,0.054199282,0.93672746,0.0013321367,0.0060233055,0.9926444,0.011425252,0.020221809,0.2695801,0.38796833,0.30109277,0.009711801,0.0016528425,0.9981078,0.0012174589,0.0006747577
"While, in the wake of the El Paso murders, the media and most of our politicians are acting shocked—“shocked, I tell you!”—that there are armed racists in America who are trying to terrify people of color, the reality is that it’s pretty much always been that way here in the United States.",1,0.93601066,0.00056763855,0.0059138634,0.9935184,0.0009976019,0.02540297,0.9735995,0.00046494923,0.0015679343,0.99796706,0.031803653,0.08530226,0.7562254,0.05383438,0.06825517,0.0045790924,0.5563374,0.99763787,0.001351448,0.0010106523
"Convicted Russian agent Maria Butina was released from a Florida prison on Friday after serving most of her 18-month sentence for conspiring to influence U.S. conservative activists and infiltrate a powerful gun rights group, and taken into custody by immigration officials to be deported to her native country.",0,0.06976042,0.99702555,0.0022053625,0.000769152,0.62178016,0.36091536,0.017304545,0.065059185,0.5131178,0.42182305,0.0071768714,0.008346068,0.089856684,0.48678613,0.39908925,0.008744974,0.00028606862,0.998485,0.00076917064,0.0007458809
Mike Pompeo is the real Iran war hawk: An evangelical Christian and hardline neocon has quietly become a dangerous power player,1,0.9481414,0.00071124133,0.011129463,0.9881593,0.0019251463,0.40066364,0.5974112,0.0006169606,0.004140466,0.9952426,0.007142456,0.0072649275,0.04066616,0.34017882,0.5963876,0.008359955,0.003210689,0.9975535,0.0012146744,0.0012318111
Elizabeth Banks pointed out that knowing what other women and men are making in Hollywood is essential to making pay equitable across gender lines. ,0,0.11815468,0.9874936,0.012112023,0.00039435262,0.6442984,0.23440069,0.12130099,0.10489048,0.27047947,0.62463003,0.013726254,0.089551166,0.7122674,0.1009764,0.07759948,0.005879373,0.017867373,0.00061055087,0.010646007,0.9887434
"Long-simmering tensions between Japan and South Korea exploded at the beginning of July, when Japan imposed restrictions on the export of chemicals crucial to electronics manufacturing to South Korea. ",1,0.6605787,0.9952017,0.004491177,0.0003071831,0.9996611,0.00024504046,9.387696e-05,0.3542719,0.5297146,0.1160135,0.0095922295,0.013561522,0.1997268,0.4204704,0.34978527,0.0068637943,0.00047380416,0.995955,0.002944527,0.001100496
"Within two weeks of Floyd’s passing in Minneapolis police custody, militant social justice warriors racked up an estimated $1-2 billion in damage, causing the costliest outbreak of political upheaval in U.S. history, devastating minority businesses while kicking off an entire summer of chaos engulfing the nation’s major cities and eventually spreading to the suburbs.",1,0.91753834,0.0881043,0.9063589,0.0055368575,0.92779535,0.017589837,0.054614875,0.0005112476,0.002831841,0.9966569,0.011730741,0.023588622,0.30248275,0.45238698,0.19870937,0.011101528,0.0016169363,0.99754435,0.0010559016,0.0013997433
"The coronavirus has presented the president with an adversary unlike any other he has confronted. It cannot be intimidated by angry tweets. It cannot be dismissed with a nickname. It cannot be diminished by calling it a “hoax,” as he did in February. And as the death toll rises, while Trump’s poll numbers fall, a new, old strategy is taking shape.",1,0.9091447,0.0041393894,0.8029292,0.1929314,0.0010089976,0.92143905,0.07755191,0.00054391765,0.00094353734,0.99851245,0.011495532,0.033633724,0.610939,0.22366287,0.111462526,0.00880631,0.16841109,0.9975662,0.0017383415,0.0006953931
And one particularly radical idea is sure to grab the attention of young people around the country: wiping out student loan debt for the vast majority of American borrowers.,1,0.8674191,0.012718785,0.9680048,0.019276334,0.44989076,0.21615116,0.33395812,0.6973742,0.056323208,0.24630259,0.007351805,0.012190145,0.12441495,0.29922703,0.5513604,0.0054555885,0.08234751,0.99660873,0.0010153616,0.002376012
"In New York, a mother-to-be faces childbirth without her husband, in Texas, hundreds of women seeking abortions are turned away, across the country, women are facing postponed mammograms and devastated by suspended fertility treatments.",0,0.24453266,0.018938707,0.9716647,0.009396525,0.00043948894,0.9993574,0.00020315658,0.0109475665,0.9876579,0.001394516,0.016732715,0.044136297,0.66583854,0.21284325,0.044359528,0.016089661,0.002260016,0.9435319,0.053000253,0.0034678006
"Sure, the coronavirus pandemic is racing through the American population like an out-of-control locomotive.",1,0.95661604,0.0011751312,0.047103822,0.951721,0.021204373,0.7001881,0.2786075,0.07128777,0.0622734,0.86643875,0.0129573345,0.0128111215,0.05978276,0.18009578,0.7280078,0.0063452898,0.40689746,0.9916848,0.0069627035,0.0013525378
"Mnuchin aroused controversy last week after he told reporters at the World Economic Forum in Davos, Switzerland, that he did not consider the outspoken Thunberg to be a legitimate critic of fossil fuel investments.",0,0.10777982,0.99659723,0.0030959188,0.0003068775,0.9994017,0.00032066577,0.00027755334,0.77677447,0.03014344,0.19308208,0.017678373,0.010595897,0.09979676,0.089150555,0.7770188,0.0057595023,0.0008759487,0.9985631,0.0008324997,0.0006043658
President Trump was “impeached forever” as Nancy Pelosi so childishly put it.,1,0.955223,0.00096267037,0.042035352,0.95700204,0.0014638321,0.0063914754,0.99214464,0.00080609095,0.000986318,0.99820757,0.005846707,0.009392235,0.09016372,0.28777927,0.60077554,0.00604253,0.5326546,0.9965744,0.002377178,0.001048463
The Republican party is holding itself together by appealing to fascist evils,1,0.94542474,0.00058800506,0.0042800093,0.99513197,0.0013079667,0.0041363123,0.9945557,0.0012950192,0.004385905,0.99431914,0.006647041,0.0075277076,0.0434963,0.3947366,0.53851306,0.009079357,0.001195638,0.99562967,0.0014956265,0.0028747702
"And most egregiously, in what will surely be viewed as one of the most ill-advised stunts in presidential history, the Trump Administration had federal security forces use tear gas and projectiles to vacate Lafayette square by force of arms so Trump could make a show of walking over to St. John’s Church and posing awkwardly with a bible held upside down.",1,0.93813425,0.011417282,0.96137416,0.027208576,0.0010745276,0.007438345,0.99148715,0.00037643322,0.0007287469,0.9988949,0.009811966,0.013101553,0.16987915,0.47616184,0.3190205,0.012025074,0.15647838,0.9985501,0.00084026344,0.00060952915
"An unidentified Mexican asylum-seeker took his own life Wednesday just yards from the U.S. border after he was denied entry, a report said.",0,0.06712786,0.99729806,0.001943452,0.000758527,0.9972785,0.0025797074,0.0001418634,0.02710319,0.9468452,0.026051605,0.038551304,0.027550165,0.20442122,0.07160382,0.6515408,0.0063327225,0.00024719327,0.96255445,0.036989752,0.00045579052
"Certainly, in a cult revolving around an omnipotent, all-seeing hero who in their mythology is reliably ten steps ahead of the nefarious liberal criminals overseeing a global pedophilia ring about to be brought to ground, the notion of a legitimate defeat at the polls is inconceivable. ",1,0.9655944,0.0007285524,0.0038360506,0.9954353,0.0012121896,0.014752902,0.9840349,0.0014530512,0.0015322535,0.99701464,0.01639433,0.016368942,0.07693373,0.058660764,0.82819825,0.0034439564,0.35656238,0.9970034,0.00083960174,0.002157042
And nothing about Trump's performance as president thus far should give anyone the confidence that he has the ability to right this ship.,0,0.5875345,0.00081327214,0.0045643626,0.99462235,0.0027373254,0.036329787,0.9609329,0.0029698522,0.004246889,0.9927833,0.10123319,0.047003787,0.07866718,0.03229294,0.7351919,0.005610974,0.11725408,0.03969709,0.0009748587,0.9593281
The home and justice secretaries have drawn up plans to fast-track the judicial system so that Black Lives Matter vandals and violent far-left protesters can be jailed within 24 hours.,1,0.20700595,0.9971424,0.0023491369,0.00050848554,0.0006564122,0.98785245,0.011491085,0.00059860636,0.004859846,0.9945416,0.008691722,0.02095647,0.3785457,0.38918504,0.19445942,0.008161621,0.008376368,0.91913533,0.05302976,0.02783491
"More than 100 gang members from El Salvador are among the massive wave of migrants that's poured across the border in recent months, with nearly 400 illegal immigrants nabbed trying to cross en masse last week and a group of more than 100 caught scaling a wall Monday, beleaguered border officials said.",1,0.9427027,0.9976877,0.0019108746,0.00040141793,0.015087271,0.9846485,0.00026416784,0.0032691103,0.9945405,0.0021903887,0.017297972,0.078961335,0.84542286,0.033737294,0.020243818,0.0043366593,0.00032862028,0.99473,0.0045812833,0.0006887241
The photograph of Katie Bouman sitting in front of her computer with the first black hole image instantly made her the face of the project — which is why an informal coterie of sexist trolls kicked off a sexist investigation to invalidate her contributions.,1,0.9394475,0.08054849,0.91262144,0.0068300897,0.005443816,0.38002422,0.61453205,0.0013323118,0.0013473284,0.99732035,0.0071420623,0.0100765,0.11210113,0.3705654,0.4940274,0.006087481,0.35993662,0.9966923,0.002214389,0.0010933772
"Still, gun-control advocates believe momentum is on their side.",0,0.08867541,0.00072339113,0.004709994,0.9945667,0.00022311241,0.9992366,0.0005403037,0.007835532,0.04115176,0.9510127,0.02532115,0.119866036,0.6857947,0.069226936,0.09483074,0.004960407,0.01759818,0.0006992913,0.0011256961,0.998175
Conservatives are rallying behind Vox journalist Matthew Yglesias after he was publically shamed by one of his colleagues for signing an open letter combatting cancel culture.,0,0.15093498,0.99178046,0.007972548,0.00024693875,0.0022163366,0.9757259,0.022057788,0.0012248877,0.0012763598,0.9974987,0.006966333,0.007783834,0.06713451,0.53473914,0.37311146,0.010264704,0.021990262,0.9985631,0.0005810416,0.0008559142
"Kenny Overstreet scrounges every penny—and even sells the eggs his chickens lay—to make ends meet after Packaging Corporation of America (PCA) furloughed him and hundreds of other workers at its Jackson, Alabama, site.",0,0.7636536,0.075489014,0.91202104,0.012489953,0.0029374498,0.8343083,0.16275421,0.0028625217,0.008618122,0.9885194,0.017916795,0.028033013,0.31993234,0.5098613,0.09434648,0.029910065,0.52536225,0.99742836,0.0016962176,0.0008754167
"He warned protestors not to use Floyd’s death to “tear up the Alamo or tear up a restaurant,” or use it as an excuse to burn or steal.",0,0.117011465,0.9954418,0.0038368914,0.0007213091,0.0031655699,0.28876117,0.70807326,0.0006637163,0.009254837,0.9900815,0.008406747,0.009496577,0.08291385,0.55599874,0.33100206,0.012181995,0.099168494,0.99800926,0.0011724008,0.0008184131
Yet the Trump family and his allies are evidently using this national emergency to enrich themselves.,1,0.939961,0.00079970417,0.0055811717,0.99361914,0.0017668142,0.006601809,0.99163145,0.0009010119,0.0018637674,0.99723524,0.009642758,0.014828182,0.16261196,0.42701295,0.37479967,0.011104556,0.0010235587,0.98430485,0.0017120026,0.013983183
The COVID-19 pandemic may be a unique situation where we can actually transform the economy to not only make it better for workers but also for the climate.,0,0.20041628,0.0009526604,0.01700762,0.98203963,0.00853505,0.020861354,0.9706035,0.0025777991,0.10337969,0.89404255,0.0072592483,0.017777707,0.17366879,0.26668847,0.52866226,0.005943496,0.30609673,0.7397862,0.012165275,0.2480485
We won’t have a truly global economy until we start taxing it that way,0,0.48085347,0.00084873644,0.0042193783,0.9949319,0.0082980255,0.008634199,0.9830678,0.16514422,0.12714307,0.70771265,0.01155172,0.013271519,0.10121659,0.079500936,0.7902545,0.0042048884,0.3969426,0.8750136,0.11596547,0.009021039
"During the same press conference, Trump defended the caravan of right-wingers that invaded Portland, Oregon, over the weekend for the obvious purpose of terrorizing the population, especially BLM protesters.",0,0.5082262,0.74382293,0.2550039,0.0011731749,0.0070772246,0.79230136,0.2006214,0.0037861124,0.023518879,0.972695,0.010532238,0.010970108,0.1349089,0.23789375,0.5977983,0.007896723,0.00023285282,0.99706775,0.0014480468,0.0014842302
"A Muslim father in Birmingham, England, is being prosecuted for removing his son from LGBT lessons, which he claims risk the safety of his child.",0,0.08628228,0.99734855,0.0022085747,0.00044289962,0.0003734896,0.9987692,0.0008572285,0.054755885,0.09834431,0.8468998,0.0069919755,0.0073057297,0.053093433,0.4446343,0.47851732,0.009457279,0.0012233229,0.9983248,0.0013267343,0.0003484007
"On Tuesday of this week, Barr continued his assault on the rule of law by rejecting federal prosecutors' sentencing guidelines for Trump minion Roger Stone, who has been convicted of lying under oath in connection with the Russia scandal.",1,0.8792551,0.8821258,0.117102206,0.00077201414,0.00978302,0.91303694,0.077180006,0.024926936,0.052215848,0.9228572,0.009876064,0.009141064,0.07643946,0.5221651,0.36663485,0.015743468,0.0002504302,0.99862134,0.0006666252,0.0007120304
The San Francisco 49ers will fly a “Black Lives Matter” flag at Levi’s Stadium as the franchise continues its support of the fight against racial inequality.,0,0.10140853,0.9960141,0.0028120617,0.0011738571,0.0028494492,0.9915085,0.0056420416,0.0016702056,0.039483935,0.9588459,0.0103542665,0.03452724,0.5404076,0.17389482,0.23157601,0.009240083,0.10655987,0.0008220965,0.002928674,0.99624926
"Donald Trump, by design, is a chaos monster who shovels crap out faster than people can process it.",1,0.947286,0.0008868528,0.0033951001,0.99571806,0.00040498076,0.99031574,0.009279235,0.0030522612,0.0015296466,0.9954181,0.008507536,0.014783338,0.118280545,0.39526203,0.45421064,0.008955927,0.07011462,0.9980367,0.0008172937,0.0011460609
"Members of the House of Representatives tax committee also pointed to other segments of Cohen’s testimony as topics likely to draw further scrutiny, including claims that Trump deflated the value of his properties to lower his tax bill and called the government “stupid” for giving him a $10 million tax refund in 2008.",1,0.689518,0.98956513,0.010107131,0.00032767156,0.0856548,0.06721495,0.84713024,0.0028110864,0.006665803,0.99052304,0.013141124,0.027729401,0.5570914,0.1742577,0.2198799,0.007900471,0.008392064,0.9987005,0.0007226787,0.0005768286
