text,bias,bias_BABESG2,objective_BABESG2,partly-subjective_BABESG2,subjective_BABESG2,nonpartisan_headline,slight-partisan_headline,hyperpartisan_headline,nonpartisan_article,slight-partisan_article,hyperpartisan_article,true_LIAR,mostly-true_LIAR,half-true_LIAR,barely-true_LIAR,false_LIAR,pants-fire_LIAR,bluff_FakeNewsTFG,negative_NewsMTSC,neutral_NewsMTSC,positive_NewsMTSC
Letters from GOP members of Congress and national pro-life leaders to the White House and the Food and Drug Administration (FDA) last week asserted Democrats are attempting to exploit the coronavirus pandemic for the purpose of advancing their party’s pro-abortion agenda.,1,0.7298046,0.898398,0.101065725,0.0005362024,0.14118975,0.65758234,0.20122795,0.0004902546,0.0014487527,0.9980609,0.0115004005,0.007012232,0.07558189,0.086666286,0.8134934,0.00574579,0.0031190403,0.99594575,0.003330264,0.00072398706
"Activist Dorian Wilde said anti-LGBT statements from officials cause stigma and discrimination towards the community, and transgender people in particular have to bear the brunt of the hatred due to their visibility.",0,0.10240858,0.9969022,0.002536129,0.0005615827,0.00070807716,0.9955029,0.003789032,0.011699826,0.8207994,0.16750072,0.008342351,0.024062723,0.39129883,0.25607938,0.3116792,0.00853755,0.00053345994,0.010451687,0.9871984,0.0023499357
"U.S. President Donald Trump retweeted a video showing one of his supporters in Florida shouting “white power” at protesters of his administration, drawing rebukes from allies and adversaries as protests continue in the aftermath of George Floyd’s death.",1,0.684542,0.9976042,0.0019776018,0.00041822653,0.017055186,0.93855745,0.04438739,0.0016107144,0.0009913258,0.9973979,0.014166232,0.028830629,0.5377808,0.2752995,0.1312451,0.01267771,0.0010775452,0.99267006,0.0068907286,0.00043922086
"Everything in the progressive agenda is aimed at dismantling nationhood, hence the creation of strains of victimhood according to gender and ethnicity.",1,0.93819976,0.0006090459,0.0043255403,0.9950655,0.00020919982,0.99186474,0.007925993,0.0016613355,0.00538129,0.99295735,0.0052206176,0.013751029,0.1440458,0.2746832,0.55582756,0.006471824,0.2233087,0.53782225,0.0073490413,0.45482874
"Backlash against marginalized communities doesn’t surprise University of Southern California Professor Chris Freeman, whose work primarily focuses on 20th century gay and lesbian studies.",0,0.23506972,0.989249,0.0098935515,0.00085741247,0.0035037966,0.85290784,0.1435883,0.0011642268,0.019909482,0.97892636,0.06844645,0.14381145,0.6627926,0.0323225,0.09010389,0.0025230723,0.17339194,0.99592966,0.0027937968,0.0012765002
"The U.S. debate over restrictions for fighting the coronavirus intensified on Monday, as protesters labeled mandatory lockdowns as “tyranny,” while medical workers and health experts cautioned that lifting them too soon risked unleashing a greater disaster.",0,0.09547983,0.99580127,0.0037363244,0.00046234284,0.99915445,0.0003755232,0.00047004415,0.008468783,0.012473536,0.97905767,0.012918586,0.018015945,0.27484113,0.48878002,0.18984292,0.0156014,0.00024151633,0.99736977,0.0018702189,0.0007599719
"Andreyah Garland, a 44-year-old single mother of three daughters, bought a shotgun in May for protection in the quaint middle-class town of Fishkill, New York. ",1,0.76936007,0.9962812,0.0029670636,0.00075174955,0.0003202202,0.99961334,6.650837e-05,0.015190752,0.9568042,0.028004976,0.009735435,0.008744268,0.07030956,0.5089163,0.39194924,0.010345132,0.0007251287,0.0026942778,0.35533804,0.64196765
The Europeans have set up a complicated barter-type system to skirt direct financial transactions with Iran and so evade possible U.S. sanctions.,1,0.9240855,0.07851244,0.9142285,0.007259098,0.9994173,0.00013347788,0.00044927368,0.3399997,0.25729918,0.40270108,0.09431686,0.37135193,0.48713562,0.015769336,0.025745498,0.0056807683,0.00025134705,0.9958728,0.002656784,0.0014704247
"As a political calculation, it shows Biden’s campaign is confident about their standing with many suburban moderates who were swing voters in the past but have moved solidly into the Democratic Party during Trump’s presidency, offended by his bullying demeanor and chaotic style.",1,0.92110586,0.012716615,0.9791316,0.008151773,0.0025489463,0.034032617,0.9634185,0.0005034638,0.0023286378,0.9971679,0.016382597,0.061830536,0.76647484,0.101747096,0.045133177,0.008431781,0.022689523,0.99597734,0.0006628864,0.0033598098
"Yet MLB, with an exhaustive 100+ page health and safety operations manual, will attempt to become the first major sport to return on July 23 with two nationally televised games, and the rest of the teams scheduled to start July 24.\",0,0.11989042,0.754029,0.24058679,0.005384261,0.0002932025,0.99946827,0.00023851247,0.0031100758,0.9885423,0.008347662,0.012137716,0.029533153,0.3643451,0.12344264,0.4656341,0.0049072723,0.21911319,0.003300774,0.9827666,0.0139325885
"The new “wealth tax” is not out of character for Warren, who has long railed against income inequality and the uber-rich, but would mark a move to the left by the party as a whole if it were adopted.",0,0.25849104,0.019524569,0.973885,0.0065904837,0.0061401813,0.01495993,0.97889984,0.023763606,0.010386641,0.96584976,0.013293706,0.031175762,0.36321846,0.13915512,0.44862604,0.0045308694,0.09235254,0.9975128,0.0009166931,0.0015705213
"Using the same alarmist language he has employed to describe illegal immigration, Trump painted Democrat-led cities as out of control and lashed out at the “radical left,” which he blamed for rising violence in some cities, even though criminal justice experts say it defies easy explanation.",1,0.94737643,0.016499927,0.97984767,0.00365246,0.0021225766,0.018528916,0.97934854,0.00025501518,0.0012320625,0.9985129,0.014161961,0.03366076,0.5001229,0.34453684,0.08180824,0.025709294,0.0002903515,0.99839574,0.000642975,0.0009613361
"Should China be the first country to develop an effective vaccine, dictator Xi Jinping has promised to provide the world with “free” coronavirus vaccines paid for by Beijing. ",1,0.30339882,0.99745554,0.0020438456,0.0005005532,0.9746396,0.02317111,0.0021892593,0.010522982,0.03472164,0.9547554,0.009297013,0.030650036,0.45863035,0.2676017,0.22541015,0.008410817,0.0016205674,0.0017716597,0.00075681886,0.9974716
Trump proceeded to ignore multiple other attempts made over subsequent weeks by his advisers and Republican allies to get him to take the pandemic seriously. Instead he dismissed their warnings as “alarmist” and would go on to hold a number of rallies (seven) and golfing outings (three) between learning of Obama’s pandemic playbook and ultimately declaring a national emergency.,1,0.7275523,0.097505964,0.8995041,0.0029898933,0.038922373,0.054464296,0.90661335,0.0003949708,0.0014842435,0.99812084,0.010010996,0.025060514,0.5030715,0.36439046,0.08409797,0.013368597,0.0005736576,0.99821836,0.0011768343,0.00060472294
"The right to abortion is just that — the right to kill unborn humans. But pro-abortionists like Quinn and Cuomo find it easier to argue that they are fighting for “reproductive rights” (even though pro-lifers are not objecting to any woman’s right to reproduce) or that fetuses are not humans but “clumps of cells.” Just as with slave owners and eugenicists before them, it’s easier for pro-abortionists to advocate for murder after they’ve dehumanized the lives they want to end.",1,0.87828004,0.00047388472,0.0054610027,0.99406505,0.0005750394,0.03184863,0.96757644,0.00036426363,0.0009267327,0.99870896,0.017718218,0.179795,0.76546663,0.02320172,0.009515938,0.0043024616,0.66352457,0.9970932,0.001361404,0.0015453057
"If your “rights” mean taking everyone else’s rights away, that is not “peaceful protest.” And to compare mob behavior to the civil rights movement is to dishonor its legacy.",1,0.90242034,0.0005495407,0.0045679645,0.99488246,0.0008881389,0.6925229,0.30658898,0.0009821076,0.0038562447,0.9951616,0.007539229,0.00702714,0.05500022,0.09561413,0.8302277,0.004591632,0.53787047,0.99837327,0.00083723327,0.00078943826
"At any other time, the U.S. would have led efforts and coordinated global fights against epidemics, but the science-averse Trump administration had already axed the CDC expert in China.",1,0.9546543,0.038668785,0.95277876,0.0085525075,0.8327004,0.03997683,0.12732272,0.018564785,0.04847368,0.9329615,0.052727982,0.050089583,0.62819123,0.05041661,0.21479572,0.0037788919,0.00028307416,0.9975274,0.0016820196,0.00079051347
"As a candidate, Trump recognized that China was taking our jobs, stealing our intellectual property, and using the United States as its piggy bank.",1,0.92315614,0.00058214954,0.0045727207,0.99484503,0.0010751511,0.017359301,0.9815656,0.00048353284,0.00088312785,0.9986333,0.01088746,0.013330656,0.15116149,0.5732325,0.22847125,0.022916721,0.00026562455,0.99813783,0.0009872192,0.0008749702
"While Americans still cling to sexist gender roles at home, overwhelming majorities believe that sex discrimination in public spaces should be illegal.",1,0.78648645,0.022389622,0.967041,0.010569376,0.00015080531,0.9993761,0.0004731377,0.0028741474,0.03745679,0.9596691,0.060430203,0.60679144,0.30945945,0.009312741,0.009871295,0.0041349167,0.003441244,0.9974948,0.0015486769,0.00095653476
An avowed white supremacist pleaded guilty on Monday for planning bomb and shooting attacks at a synagogue and LGBTQ bar in Las Vegas. ,0,0.07980917,0.9975737,0.0018938421,0.00053252274,0.00015614412,0.9995664,0.00027744556,0.0021743001,0.0046337936,0.9931919,0.0057797804,0.0055276616,0.049597196,0.15194984,0.7831373,0.0040082787,0.00028008063,0.99841905,0.00096206286,0.00061893614
The true elegance of ranked choice voting is that it encourages candidates to campaign and to govern in an inclusive manner that leads to better representation for everyone. It incentivizes candidates to look beyond their base and seek out second-choice support.,0,0.20243579,0.0011867208,0.008645706,0.9901675,0.0017238905,0.84873027,0.1495458,0.07103073,0.18551725,0.74345213,0.04483991,0.21053155,0.696947,0.01663826,0.027694887,0.0033483983,0.24130014,0.0007567185,0.00030905617,0.9989342
Trump's comments came during a mega-rally in the world's largest cricket stadium — part of an elaborate Indian welcome for a president who revels in pomp and pageantry.,1,0.74693054,0.70343846,0.2954791,0.0010824342,0.008336843,0.057982326,0.93368083,0.16324693,0.23745589,0.59929717,0.012226716,0.012934137,0.12636688,0.24397452,0.59718275,0.0073149726,0.0002545706,0.004313381,0.0060671647,0.98961943
The House Democrats’ coronavirus recovery bill allows several hundred thousand foreign workers to get college jobs or blue-collar jobs while millions of Americans lose their careers.,0,0.2906096,0.4401768,0.55800474,0.0018184052,0.0011997593,0.99862075,0.00017949785,0.0042521846,0.008560592,0.98718715,0.0062307143,0.018303588,0.44125873,0.39089704,0.13444442,0.008865568,0.00030089647,0.9842727,0.013346234,0.002381094
"Still, the CDC has withdrawn tracking numbers about testing from its website, fueling the belief that the White House is still playing politics with health information.",1,0.31050506,0.010608157,0.9696549,0.019736892,0.009226892,0.9892281,0.0015449815,0.015171437,0.03638708,0.94844145,0.03246549,0.05177973,0.8067544,0.041580595,0.059944488,0.0074753533,0.00079168315,0.99612564,0.0034207352,0.00045366198
"Despite an estimate showing that China — the world's biggest polluter — emitted 25 percent less carbon than in the same four-week period the previous year, Shuo remains skeptical about any lasting changes.",1,0.1264792,0.38917932,0.6083274,0.0024932702,0.99635845,0.0007138661,0.0029276698,0.12828587,0.26508725,0.6066269,0.02991791,0.119654745,0.6988543,0.05365159,0.09332124,0.004600211,0.00052611815,0.77666545,0.21994567,0.003388912
Lawmakers specifically said they want to protect women from facing unfair competition from men who claim to be transgender women.,1,0.10150812,0.9969995,0.0022349965,0.0007655104,0.0022222693,0.996833,0.00094467885,0.1634709,0.82944995,0.0070792106,0.012136882,0.02370468,0.3003362,0.13567793,0.5230069,0.0051373546,0.00037885926,0.025386086,0.007218472,0.9673954
"Last week, black transgender woman Iyanna Dior was beaten by a mob at a gas station in Minneapolis, and video of the attack has gone viral online with millions of viewers.",0,0.080862716,0.99717015,0.0021961418,0.0006337598,0.00025125188,0.9996275,0.00012127244,0.019325325,0.6067723,0.37390235,0.014283814,0.032599173,0.49226245,0.32242844,0.12777022,0.0106559275,0.0010939111,0.99712974,0.0020192713,0.00085100567
"New York City parents and those across America where these evil restrictions are reemerging have to remember, and have to punish at the polls the politicians who steal this from our kids.",1,0.8955591,0.00066484563,0.003921791,0.99541336,0.00030730639,0.999169,0.00052366685,0.0017725804,0.013551443,0.98467594,0.008878412,0.01227838,0.11483582,0.52672356,0.32385775,0.013426102,0.34718627,0.99792516,0.0009462051,0.0011286166
"Polling throughout the Democratic primary showed Sanders triumphing with young voters by massive margins, and early polling in the general election has shown Biden running weaker with younger voters than past Democratic nominees.",0,0.11297545,0.9940544,0.0050120996,0.00093356095,0.14676724,0.84913635,0.004096363,0.023128415,0.6060565,0.3708151,0.025858916,0.19763373,0.7541252,0.014838459,0.0052166525,0.0023270915,0.00035938714,0.0029983292,0.0005060716,0.99649566
"Middle-class exodus: From 2007 to 2016, California lost a net million residents — some 2.5% of its population (which still grows due to births and immigration). ",1,0.89892155,0.9961855,0.0027511686,0.0010633311,0.00024086969,0.9996611,9.7996504e-05,0.008587662,0.9830483,0.008364006,0.032197963,0.2484998,0.70157486,0.010044445,0.0057270294,0.0019559613,0.0009077097,0.96590436,0.032256015,0.001839711
"With this in mind, the Trump administration reportedly hopes to reduce poverty in the United States, not by making a material difference in struggling families’ finances, but by tinkering with the threshold for what counts as poverty.",1,0.899356,0.11889711,0.8786135,0.0024894,0.29863358,0.102694735,0.5986717,0.0010975113,0.0029829994,0.99591947,0.008261621,0.0414298,0.74526507,0.14891975,0.04459921,0.0115245925,0.0003249342,0.37733802,0.0036907394,0.6189712
"Immigration Voice claims to be an independent group, but reportedly works closely with Compete America, an advocacy group formed by the nation’s major tech companies, nearly all of whom employees large blocs of Indian and Chinese visa-workers in jobs that could be filled by young American graduates.",1,0.38243073,0.9953467,0.0043021883,0.00035113504,0.09444969,0.8966895,0.008860804,0.005625904,0.0135423215,0.9808318,0.08718942,0.2125013,0.5414138,0.035297107,0.11700362,0.006594767,0.17994457,0.017626775,0.930171,0.05220219
"Dexter Faircloth stalked the streets of Houston’s Third Ward, the historic Black neighborhood where he was born and raised, shouting greetings and asking an urgent question.",0,0.32132092,0.9927545,0.006709009,0.000536418,0.00019782153,0.99705315,0.0027490046,0.0056906953,0.41459385,0.57971543,0.017802952,0.018612035,0.10679307,0.52433723,0.30895722,0.023497479,0.34289938,0.99769956,0.001516049,0.00078441174
"In office, however, Trump has continued the GOP crusade against Medicaid. ",1,0.8533538,0.027690904,0.962608,0.009701087,0.0040944833,0.7533282,0.24257734,0.003604681,0.026023803,0.9703715,0.009898975,0.036989126,0.8451826,0.065380625,0.034576144,0.007972496,0.0003298894,0.9979487,0.0014885395,0.0005628146
The battle of Portland is just plain crazy — but what else would you expect in Donald Trump’s dystopian America?,1,0.95372266,0.0010514634,0.0036356044,0.9953129,0.0037982308,0.12854639,0.86765534,0.000686224,0.00049510814,0.9988187,0.027385727,0.042907093,0.20900263,0.094781466,0.62119484,0.0047281813,0.53658104,0.9973003,0.0017637843,0.0009359356
"Even prior to Trump formally announcing Barrett as his nominee, leftists launched a string of attacks, targeting her faith, family, and conservative positions.",1,0.86158013,0.011186673,0.9643685,0.024444802,0.0062366566,0.29037973,0.70338356,0.0008039953,0.0025442203,0.9966518,0.017054014,0.034982793,0.8024512,0.0874414,0.048358902,0.009711655,0.0003124171,0.9981072,0.0009223801,0.0009703827
"After Steve King’s offensive implication that white people own Western civilization, Chris Hayes predictably responded with an idiotic remark about Western civilization giving us Hitler.",1,0.96754944,0.016284524,0.9712223,0.012493156,0.0022222628,0.64203614,0.35574153,0.0005699732,0.00046716921,0.9989629,0.017581712,0.016360141,0.11625437,0.5798473,0.23389691,0.036059536,0.11931232,0.99862874,0.00070526404,0.000666041
"Instead of giving way to despair, Christians should master themselves, strive for virtue, and suffer with dignity. The virus and shutdowns, grave as they are, will pass, but everyone can learn from them and be more than members of the passive herd beholden to external forces.",0,0.70271546,0.0008317528,0.003832373,0.9953359,0.00016184092,0.9990682,0.0007699866,0.01580334,0.19676928,0.78742737,0.012321224,0.054490604,0.44401595,0.23734058,0.24459192,0.0072397604,0.20095444,0.043970633,0.00087643944,0.955153
"Republicans could try again to repeal Obamacare if they win enough seats in U.S. elections next month, Senate Republican Leader Mitch McConnell said on Wednesday, calling a failed 2017 push to repeal the healthcare law a “disappointment.”",0,0.07136523,0.9956809,0.0038976702,0.0004213713,0.9997249,0.00018602445,8.899567e-05,0.03573143,0.0167308,0.9475378,0.0133867515,0.020862777,0.44914696,0.28040275,0.22319403,0.013006771,0.00030384728,0.5515279,0.44671485,0.0017572517
"Democratic candidates attacked Republican U.S. President Donald Trump’s handling of the coronavirus outbreak on Thursday, as stocks plunged on fears of the growing outbreak",0,0.3087213,0.99644405,0.0031344783,0.00042139474,0.99936324,0.0003236538,0.00031311228,0.002069665,0.0009737802,0.99695647,0.0072575994,0.013727258,0.22425199,0.47485897,0.26633614,0.013567961,0.0002468061,0.9981086,0.0010600076,0.0008313895
Republican Senator Rand Paul on Friday called on the FBI to investigate a crowd of protesters that swarmed him as he departed the White House after listening to U.S. President Donald Trump accept his party’s nomination for re-election.,0,0.06664539,0.99713135,0.0020703792,0.00079820957,0.9996674,0.00023856273,9.401328e-05,0.0075665764,0.013208168,0.9792252,0.009103237,0.007225956,0.0676936,0.41538826,0.49101436,0.009574626,0.00038419006,0.90563536,0.09329466,0.0010699611
"It wasn’t President Donald Trump’s escalating demands that the U.S. central bank lower interest rates, or Kaplan’s view of the U.S. economy that attendees at the lunch in Corpus Christi wanted most to know about. ",0,0.50779814,0.047420662,0.9475924,0.00498696,0.38605776,0.033102456,0.58083975,0.0015296927,0.003329398,0.9951409,0.011655446,0.017491188,0.2816929,0.1799155,0.5021058,0.0071391873,0.14798357,0.8760114,0.12293541,0.0010531371
"Reuters photographer Dylan Martinez heard the words ring out during chaotic scenes in London on Saturday, when mostly peaceful anti-racist demonstrations turned into violent scuffles with counter-protesters in the area.",1,0.52388245,0.9965951,0.003028265,0.00037655354,0.36224166,0.6286006,0.0091577405,0.99786323,0.0007317813,0.0014049311,0.017743753,0.026422197,0.25514674,0.26339152,0.42995042,0.0073454096,0.00041641708,0.7672609,0.2303375,0.0024016106
"Alphabet Inc.’s Google, the world’s largest online advertising platform, blocked advertising from finance blog ZeroHedge.com last week because of what it deemed hateful comments from users posted to the website’s articles.",0,0.08879472,0.99706227,0.0026025255,0.0003352388,0.99938345,0.0004281684,0.00018832061,0.12703942,0.0073085143,0.86565214,0.023211204,0.019854877,0.19443867,0.09529584,0.6613638,0.005835652,0.2802443,0.99813086,0.0014086233,0.000460534
"In reality, the Trump administration implemented Operation Warp Speed, which created a public-private partnership to fast-track a coronavirus vaccine.",0,0.12819141,0.9954684,0.003829602,0.000702008,0.55341256,0.10407776,0.3425097,0.016798196,0.0048091603,0.9783927,0.006405397,0.010007389,0.17524815,0.39393827,0.40628725,0.008113514,0.0024183597,0.91158587,0.0781197,0.010294453
"She is one of Donald Trump's natural heirs, even using his patented lies and happy-talk approach to the virus, telling lawmakers recently that ""in South Dakota, we didn't take a one-size-fits-all approach and the results have been incredible.""",1,0.9199278,0.0011632902,0.09958506,0.89925164,0.00023889252,0.9959074,0.003853637,0.009783041,0.002533372,0.9876837,0.3017753,0.10838051,0.4954598,0.026366962,0.06326341,0.004753981,0.0073987436,0.997575,0.0007624439,0.0016626312
The astute observer will note that China is not exactly eager to take in large numbers of migrants or refugees from beyond its borders.,1,0.906015,0.0069650873,0.7447101,0.24832484,0.9520874,0.035219166,0.012693518,0.109806776,0.79257745,0.09761573,0.3147885,0.42828047,0.14885287,0.01491202,0.08915328,0.004012894,0.0003035716,0.446427,0.15159196,0.40198106
"The Conservatives may have surrendered every last joint of ideological backbone to the forces of Social Justice, identity politics and weaponised resentment.",1,0.94914144,0.0006314622,0.0040807477,0.9952878,0.00057964644,0.050168622,0.9492518,0.01594534,0.012386308,0.9716684,0.0738649,0.18310435,0.5070462,0.041323774,0.1910825,0.0035782282,0.013764402,0.9977361,0.0007835428,0.0014803028
"Human rights defenders have said security forces were deployed to enforce lockdowns mainly in poor black areas like high density townships, where higher population numbers and overcrowding made it impossible to properly isolate.",0,0.08752356,0.996784,0.0024535875,0.0007624273,0.0014221036,0.99236006,0.0062178527,0.0038805862,0.99046993,0.005649502,0.019336605,0.06628908,0.79651815,0.050865382,0.062640876,0.0043498944,0.0005338282,0.92473215,0.07188406,0.0033838507
Lawmakers are treading a dangerous and unconstitutional path in the service of fear-driven objections to trans existence.,1,0.9652385,0.00059989933,0.004532326,0.9948678,0.00050347456,0.9524525,0.047044028,0.0030779336,0.010639133,0.9862829,0.006744601,0.008665348,0.06213797,0.45269248,0.4596967,0.010062872,0.15731704,0.99798167,0.00095588795,0.0010623352
"Their lawyers argue that Title VII of the 1964 Civil Rights Act, which prohibits workplace discrimination based on sex, also applies to discrimination against LGBTQ people.",0,0.0856013,0.9963198,0.0029126809,0.0007674408,0.0012287905,0.98795766,0.010813527,0.00242002,0.054316826,0.9432632,0.008483319,0.009968489,0.10487312,0.25027475,0.6203632,0.00603716,0.047262605,0.559169,0.4386754,0.0021555622
"Trump is also attempting an obvious slow-motion coup, in which he is purging senior national security officials who have shown themselves unwilling to do his bidding, for example, by turning the country's military against the American people.",1,0.8909916,0.0004946351,0.013380204,0.98612505,0.00082068745,0.0020511933,0.9971282,0.0013892779,0.0018776827,0.99673307,0.010198504,0.011385145,0.10272712,0.6221923,0.23115197,0.022344928,0.00032291547,0.9982753,0.000697976,0.0010267573
"After health officials near Portland, Oregon, declared a public health emergency over a measles outbreak that affects mostly young children, the viral infection continues to spread.",0,0.13671401,0.9974809,0.002011598,0.00050749624,0.00036899344,0.9995034,0.0001276357,0.25019833,0.48665124,0.26315045,0.046615418,0.06926648,0.7878901,0.039535027,0.052344956,0.004348064,0.004264495,0.7241769,0.27107713,0.004746003
"Juneteenth, a portmanteau of June and 19th, also is known as Emancipation Day.",0,0.095547825,0.9898044,0.0075427447,0.002652804,0.0002343925,0.99971145,5.416537e-05,0.07999154,0.76901186,0.15099663,0.045150906,0.056848243,0.19598916,0.06683598,0.6291448,0.0060308967,0.05000442,0.014019992,0.95069605,0.035283994
"Throughout the anti-racism protests that have rocked the United States since the killing of George Floyd in Minneapolis on May 25, President Donald Trump and his obedient sycophants at Fox News have engaged in nonstop fear-mongering over the Antifa movement.",1,0.9402905,0.0033485224,0.8026494,0.1940021,0.001924613,0.03240219,0.9656732,0.0005633436,0.00050421373,0.9989324,0.02854379,0.053954236,0.81657255,0.049962584,0.0458482,0.0051186862,0.04286772,0.99803513,0.0008798956,0.0010849754
"Police shooting deaths and other deaths enacted by officers largely impacting the black community have been the focus of recent protests, yet other communities, such as the Latinx community, also suffer disproportionately from such violence, taking innocent lives.",0,0.106016934,0.9960322,0.0035756335,0.00039215916,0.00050939893,0.99767345,0.0018170974,0.012861027,0.87735045,0.109788515,0.03718102,0.29719803,0.6362563,0.01696786,0.006599256,0.0057976143,0.005520051,0.9967193,0.0019606971,0.0013199713
"More subtly, however, Pelosi is also using her gender to put Trump — who is visibly unnerved by having any woman around that isn’t clearly there to serve him, sexually or otherwise — on his heels. ",1,0.93614656,0.00061997393,0.0074504935,0.99192953,0.00237393,0.0045857863,0.9930402,0.0007348122,0.00073798053,0.99852717,0.009609804,0.013928792,0.16308095,0.5372208,0.26004764,0.016112002,0.13284883,0.99836344,0.0007589511,0.00087763905
