text,bias,bias_BABESG2,objective_BABESG2,partly-subjective_BABESG2,subjective_BABESG2,nonpartisan_headline,slight-partisan_headline,hyperpartisan_headline,nonpartisan_article,slight-partisan_article,hyperpartisan_article,true_LIAR,mostly-true_LIAR,half-true_LIAR,barely-true_LIAR,false_LIAR,pants-fire_LIAR,bluff_FakeNewsTFG,negative_NewsMTSC,neutral_NewsMTSC,positive_NewsMTSC
There is no doubt that there have been U.S. government missteps on the path towards trying to control the spread of coronavirus.,1,0.7812562,0.002501534,0.2626395,0.734859,0.99971586,0.00012550491,0.00015856653,0.047732312,0.027129607,0.92513806,0.40709588,0.2872236,0.22180478,0.013139422,0.06329604,0.0074402606,0.00046675061,0.9962769,0.0027875004,0.0009354939
"Dozens of potential jurors were excused on Wednesday from serving in the rape trial of Harvey Weinstein, as the former movie producer’s lawyers accused the judge presiding over the trial of bias.",0,0.08120644,0.996655,0.0029074724,0.00043742507,0.374138,0.6165804,0.009281593,0.0015577615,0.0011026553,0.99733967,0.009361115,0.008818905,0.08456168,0.5062808,0.3809273,0.010050199,0.0017324539,0.9980678,0.0013407543,0.0005914638
"A California rock known for being a canvas for local artists, became the site of a neighborhood battle after ""Black Lives Matter"" artwork was painted over multiple times this past week, according to a report on Monday.",0,0.07285988,0.997707,0.0017892644,0.00050371053,0.0009439624,0.99883753,0.00021852659,0.030305978,0.8871909,0.08250312,0.012937344,0.018311162,0.34731975,0.2446958,0.37105188,0.005684019,0.0013225487,0.93920076,0.029164506,0.031634767
White nationalist arrested for alleged threat against Ohio Jewish community center.,0,0.102917776,0.9964342,0.0029220723,0.0006437439,0.00018831005,0.9996848,0.0001269053,0.0058779716,0.978542,0.01558,0.005623447,0.0085972585,0.08243955,0.255536,0.64027554,0.0075281546,0.00042953447,0.9873059,0.012128797,0.00056532957
"Despite pre-existing and new guidelines, critical decisions made by governors and state leadership have, in some cases, exacerbated the crisis. In New York, Gov. Cuomo’s instruction for long-term care facilities to continue accepting patients with COVID-19 led to devastating results.",1,0.29506558,0.10301128,0.89296675,0.0040220534,0.0011195018,0.9985494,0.00033112837,0.0009587979,0.015007857,0.98403335,0.008044474,0.028168973,0.5923135,0.25036243,0.11388388,0.007226675,0.0074791545,0.99662316,0.0022035013,0.0011733159
The new judges are picked by Trump’s attorney general and cannot be blocked by hostile Democrats.,1,0.42162764,0.762887,0.23528077,0.0018322613,0.00048490494,0.9968851,0.0026299173,0.0005211741,0.0054700575,0.9940088,0.015893692,0.026261117,0.25822344,0.13790077,0.55737114,0.0043498008,0.00047136282,0.00460262,0.9938886,0.0015087911
"Chinese state media outlets have been bursting with criticism for President Donald Trump during the current round of riots, but the Chinese Communist Party (CCP) also tossed a few bricks at former President Barack Obama and his Democrat Party, needling them for doing little about racial issues and touting China’s efforts to care for its poor and disenfranchised as vastly superior to the Democrats’ half-hearted socialism.",1,0.96139526,0.011993492,0.9802742,0.0077323527,0.0027088774,0.041055165,0.9562359,0.00073887844,0.0039530382,0.9953081,0.0281643,0.10267843,0.8420796,0.01485779,0.008029898,0.0041900165,0.0038702216,0.9984357,0.0006439586,0.00092044525
"The 2020 electorate seems to have about the same digestive system as a goose, which is to say that it doesn’t seem to hold on to anything for very long.",1,0.9145041,0.0007053739,0.00487944,0.99441516,0.023728076,0.7653519,0.21092005,0.12528284,0.12827662,0.7464406,0.25951195,0.6462426,0.06926248,0.004890492,0.018243648,0.001848842,0.24852723,0.04329251,0.89840925,0.05829823
That's why it's reasonable to be skeptical about the likely success of the current crop of wannabe Trumps. ,1,0.953238,0.00066405564,0.0037210186,0.9956149,0.0042973035,0.005814096,0.9898886,0.003827402,0.0024367897,0.9937358,0.048505303,0.03439062,0.12315854,0.05827343,0.7298678,0.005804287,0.16831413,0.99421024,0.004667993,0.0011218371
"As part of Pelosi’s coronavirus plan, House Democrats slipped in multiple measures from their H.R. 1 legislation that would implement nationwide ballot harvesting for federal elections — effectively allowing political operatives to collect and deliver an endless number of absentee ballots from voters.",1,0.72565895,0.27463365,0.7228293,0.0025370885,0.12338289,0.3860405,0.49057662,0.00079634023,0.0010176178,0.99818605,0.010837487,0.015341876,0.26202506,0.5442208,0.14833596,0.019238817,0.0002732018,0.99628097,0.0027718437,0.0009471255
"This is all great news. It now looks like we have a safe, highly effective vaccine that has the potential to significantly reduce many forms of cancer. So why is it also becoming a key target of many anti-vaxxers?",1,0.73752576,0.054212485,0.893758,0.05202953,0.00022669749,0.99948263,0.00029068036,0.3210441,0.07147211,0.6074838,0.03446074,0.098075315,0.63903624,0.054864764,0.17015557,0.0034073382,0.56431794,0.0008158934,0.0006895231,0.9984945
"Republicans should stop fighting amnesty, President Obama said on Thursday, because one day a Hispanic will become president.",0,0.07776261,0.9962465,0.0027041917,0.0010492733,0.0005072523,0.99938834,0.000104345476,0.0046972316,0.9903307,0.004972029,0.0074297767,0.009628795,0.1247858,0.45671538,0.3895136,0.01192673,0.00024156747,0.0017285337,0.9724769,0.025794577
U.S. women’s soccer team co-captain Megan Rapinoe is begging prominent male soccer stars to must begin agitating for political causes.,1,0.92245376,0.562717,0.4357367,0.0015463328,0.5343272,0.4644528,0.0012199744,0.014554593,0.054336097,0.93110937,0.01269857,0.010368952,0.05770134,0.5591481,0.34086555,0.01921749,0.0035392914,0.000575814,0.0006623809,0.9987619
"As people sip cafecito and eat croquetas at the landmark restaurant, the buzz here these days is what Cubans say is the alarming rise of Democratic presidential frontrunner Sen. Bernie Sanders, whose unabashed defense of late Cuban dictator Fidel Castro has riled Cuban-Americans who view his comments as a personal attack.",1,0.84987664,0.0077518118,0.9834485,0.008799712,0.014475178,0.9322399,0.05328495,0.008499467,0.201305,0.7901956,0.01635671,0.040222567,0.58499026,0.2091065,0.13907355,0.010250399,0.022110537,0.9981956,0.00073030416,0.0010741175
"In July 2019, Rep. Alexandria Ocasio-Cortez, D-N.Y., and other Democrats visited a similar processing center in Clint, Texas, and made explosive allegations about the conditions there.",1,0.9188822,0.9968008,0.0027665733,0.00043269698,0.0025748233,0.9951953,0.0022298736,0.1469529,0.12668756,0.72635955,0.0107807955,0.00832628,0.07731776,0.4485218,0.44314396,0.011909401,0.00048346526,0.9975545,0.0017739856,0.00067155965
"Then the tenor changed. What started as irony turned into an actual belief that white people, specifically white men, are more dangerous and immoral than any other people.",0,0.82008666,0.0007635171,0.009887545,0.9893489,0.0004146636,0.9834034,0.016181912,0.0062781577,0.01400817,0.9797136,0.01032689,0.013708837,0.13351156,0.41778505,0.412878,0.011789704,0.38280928,0.99795294,0.0011590845,0.0008880037
"On Friday, Trump said he remained ready to help South Korea and Japan solve their lingering dispute over World War II-era forced labor that has blighted their trade ties.",0,0.07894171,0.9968182,0.002197084,0.0009847817,0.94096166,0.05638043,0.0026578591,0.52329445,0.4728034,0.0039021662,0.00921834,0.015513895,0.2748737,0.41572013,0.2719524,0.012721521,0.00026938104,0.0011617448,0.00051271415,0.9983255
But Hedges also sees hope for saving the United States from imminent tyranny. Where? In the George Floyd protests and the possibility of revolutionary change.,1,0.9179145,0.018580183,0.9756908,0.0057290276,0.00019226073,0.99945813,0.00034966716,0.0038152249,0.14417735,0.8520073,0.012909765,0.029994344,0.39866015,0.31921276,0.22669716,0.012525779,0.05154244,0.00080620375,0.0007755193,0.9984182
"President Donald Trump's top health advisers – Anthony Fauci and Deborah Birx – showed up at a White House event Friday with protective masks, though the president himself continued to spurn any kind of face covering.",1,0.8894556,0.9967338,0.0026977696,0.0005683831,0.006900852,0.99091583,0.0021833398,0.0013691168,0.0014925825,0.99713826,0.011619512,0.02051927,0.33442548,0.45734325,0.158718,0.017374521,0.0031073801,0.9963888,0.0029332493,0.0006779831
"In 2017, the Pentagon argued in favor of keeping the Selective Service system – and expanding it to include women.",0,0.10120402,0.99591297,0.003576416,0.0005105816,0.02465315,0.9673465,0.00800033,0.010981043,0.18861723,0.8004017,0.009949687,0.018877137,0.4409502,0.21082684,0.31358612,0.005809962,0.0030639672,0.002649904,0.05074474,0.9466053
New York City Mayor Bill de Blasio (D) suggested on Monday that the return of indoor dining will depend on a “huge step forward” in developments of a coronavirus vaccine.,0,0.09910867,0.99496174,0.0041716928,0.00086658826,0.99583936,0.0040806457,8.0012745e-05,0.062307756,0.059785545,0.8779067,0.007387401,0.008928677,0.10381622,0.43256313,0.43921694,0.008087674,0.024513314,0.00081149966,0.9955967,0.0035918264
"Donald Trump used his mighty Twitter platform to drum up business for his golf course in Los Angeles on Sunday. U.S. deaths from COVID-19 neared 80,000, but the president didn’t tweet about that. ",1,0.94531244,0.035805836,0.9503306,0.013863559,0.8517839,0.14739986,0.00081625744,0.0010063918,0.0044977344,0.9944958,0.009420669,0.015647108,0.20260872,0.527413,0.23375928,0.011151222,0.0003185949,0.010827916,0.0018969169,0.9872751
Thousands of people across Australia attended Black Lives Matter protests on Saturday wearing masks and practising social distancing amid warnings from state leaders to call off the events on fears of a second wave of coronavirus infections.,0,0.08321729,0.99754876,0.0019044734,0.0005467286,0.9503619,0.04802444,0.0016136162,0.028951146,0.30543345,0.66561544,0.011118252,0.018609226,0.22064044,0.52159345,0.21398078,0.014057873,0.0003362667,0.9765415,0.014046515,0.009411997
"While falling short of calling half the nation “deplorable” as former Secretary of State Hillary Clinton did in 2016, the comments echo a deep disdain for a large population of the country increasingly perpetuated by left-wing elites in the wake of the George Floyd protests characterizing the U.S. as irredeemably racist.",1,0.9181632,0.015414246,0.97837824,0.0062075024,0.07149001,0.013744971,0.914765,0.0005618868,0.0008839805,0.99855417,0.019878041,0.07992039,0.84030116,0.029423935,0.0277539,0.0027226002,0.024019295,0.99847645,0.0006551219,0.00086840097
"Job and revenue losses prompted by the coronavirus will likely accelerate the depletion of Social Security and Medicare reserves, U.S. officials said on Wednesday as they released reports showing little change in the federal benefit programs’ pre-pandemic finances.",0,0.083239496,0.99709296,0.0020864056,0.00082057,0.99957424,0.0002444352,0.0001813153,0.6745117,0.025885848,0.2996025,0.009635503,0.02075319,0.34345415,0.42114404,0.19197658,0.01303662,0.0002592168,0.18717605,0.8105616,0.002262368
A Black policewoman was injured and at least four people stabbed when a day of demonstrations in support of President Donald Trump's election delusions ended in violence Saturday night in Washington D.C. ,0,0.102907166,0.9936283,0.004480494,0.0018912201,0.9870609,0.0123985,0.0005406055,0.0009176825,0.005633071,0.9934493,0.010669863,0.019016255,0.2579259,0.318427,0.38483045,0.009130479,0.00031946052,0.99783224,0.0014699775,0.0006977663
The increasingly bitter dispute between American women’s national soccer team and the U.S. Soccer Federation spilled onto the field Wednesday night when players wore their warm-up jerseys inside outin a protest before their 3-1 victory over Japan.,0,0.11239717,0.9962058,0.0034990027,0.000295074,0.041856438,0.95761293,0.0005306661,0.020280443,0.9080645,0.07165504,0.0091461195,0.010598386,0.10867215,0.29739884,0.5680293,0.0061551537,0.0022899737,0.99566793,0.0034283272,0.00090377376
"They all swing radical left, they all pay homage to the identity politics pieties of the Social Justice movement, they all brutally enforced conformity on #MeToo, and now they’re doing the same with Black Lives Matter.",1,0.94779086,0.0006997623,0.004982609,0.9943176,0.00023677836,0.9945701,0.00519315,0.00031844756,0.0007122541,0.9989693,0.014386583,0.09092462,0.8365272,0.04227941,0.0103046615,0.005577539,0.5376382,0.99793744,0.0007927564,0.0012697917
Proposals to restructure repayment programs or dip into retirement accounts don’t prevent students from taking out dangerous amounts of student loans in the first place.,0,0.09930376,0.059689544,0.9346043,0.0057062027,0.0007006964,0.99913955,0.00015975005,0.08634295,0.836715,0.07694207,0.04581072,0.20221834,0.7077722,0.017103693,0.024041105,0.0030539387,0.016397463,0.9970331,0.0019487989,0.0010181449
"Trump is nothing if not a public relations savant. Once the dust settles, if he cannot take credit for restoring order, he’ll do his best to deflect and lay the blame at someone else’s feet. He’ll remind his followers what the other side thinks of them, how they desecrated our American values, and what will happen to them if Joe Biden becomes the apologizer-in-chief.",1,0.9126814,0.0005256958,0.0060794046,0.9933949,0.0010730161,0.02337075,0.97555625,0.00030108602,0.0005142491,0.99918467,0.011629744,0.013218499,0.14139417,0.5575765,0.255097,0.021084055,0.37897772,0.99422497,0.00064637506,0.00512859
"Facebook, YouTube and Amazon all answered with policy changes, removing some fear-mongering content related to vaccines.",1,0.9268752,0.01997554,0.9712058,0.008818733,0.0016591342,0.9982728,6.8084075e-05,0.86882097,0.017761137,0.11341784,0.009633883,0.017544752,0.31366348,0.44972384,0.19745086,0.011983152,0.00042699455,0.40933555,0.5592805,0.031383958
"Right wing demonstrators fought with leftist counter protestors in Georgia, Michigan and Oregon on Saturday drawing in riot police and SWAT teams.",0,0.07540326,0.9972972,0.0022931152,0.00040966304,0.000812125,0.9986994,0.0004884659,0.007992279,0.060427263,0.9315804,0.016409744,0.016911792,0.1161248,0.5756568,0.24769863,0.027198227,0.000309167,0.99652797,0.0023854345,0.00108659
The U.N. Human Rights Council on Friday condemned discriminatory and violent policing after the death of George Floyd in Minneapolis last month and ordered a report on “systemic racism” against people of African descent.,0,0.07684738,0.99693406,0.002322931,0.00074305903,0.35546252,0.63258886,0.011948637,0.0009744297,0.0043809083,0.99464464,0.007814879,0.009481441,0.12097947,0.36589637,0.48636225,0.0094655845,0.0028347825,0.99738914,0.0015143976,0.0010964402
"The 81,000-plus transactions in June also set the all-time record for more transactions in a single month, since Virginia State Police “began tracking [transaction] data in 1990.”",0,0.09055879,0.99001944,0.009394502,0.0005861147,0.11517708,0.88213223,0.0026907332,0.18404825,0.782251,0.033700697,0.5775854,0.24342932,0.14983405,0.007687691,0.018773282,0.0026902885,0.046601184,0.01384158,0.7126717,0.27348667
"Of course, viruses don’t just “go away” regardless of the amount of propaganda or wishful thinking you throw at them. His theory, however, is telling. Trump’s strategy from the beginning of this crisis has been to minimize the threat and wish it away.",1,0.8869471,0.00052414124,0.006295381,0.9931805,0.0014928207,0.017486745,0.98102045,0.0006622325,0.0009134239,0.9984244,0.011540746,0.031381775,0.4282842,0.29555628,0.22314107,0.010095953,0.2146098,0.991529,0.004612498,0.0038584834
"Calls are growing for police to be banned from marching in Pride parades and for the LGBT+ events to return to their roots as rebellions against police brutality amid a rolling, global anti-racism movement.",0,0.09258924,0.9824269,0.01714949,0.00042359476,0.0014925135,0.9649575,0.033549976,0.00517594,0.7754879,0.21933608,0.009804567,0.017833697,0.21071574,0.57622755,0.1668633,0.018555159,0.0018412024,0.99494076,0.002600217,0.0024590155
"The odds of giving birth prematurely was also higher in pregnant and recently pregnant women with COVID-19, compared to those without the disease.",0,0.09687051,0.99532986,0.004042587,0.00062749704,0.00061084103,0.9992355,0.00015360385,0.0171725,0.95793027,0.024897182,0.029307803,0.2281533,0.7138647,0.01513683,0.011165758,0.0023715934,0.34759223,0.055172157,0.8662064,0.07862143
Closing the gender pay gap is not rocket science – even though recently graduated female rocket scientists earn 89 cents on the dollar to their male peers.,1,0.51085883,0.0006029674,0.004743077,0.99465394,0.00021442927,0.9994661,0.00031941728,0.040360007,0.81568223,0.14395775,0.052843362,0.48424762,0.4454911,0.008386073,0.007618372,0.0014135197,0.08054621,0.22426234,0.283887,0.49185064
"As the number of Americans eligible for the Medicaid low-income health insurance program grows through expansion under the Affordable Care Act (ACA), some states are aiming to trim the rolls by requiring recipients to work or satisfy related criteria. ",0,0.08690934,0.9960056,0.003305853,0.0006885115,0.6381142,0.35892427,0.0029615045,0.10705217,0.26274502,0.6302028,0.013882752,0.063126385,0.8853661,0.022331037,0.011626208,0.0036675308,0.021668322,0.9087451,0.086418696,0.004836178
It’s also why attempts to portray pro-lifers as racists smack of disingenuousness.,1,0.9570888,0.0010800548,0.0042307614,0.9946891,0.0011401403,0.9434036,0.055456307,0.0011783851,0.0038965004,0.99492514,0.015070821,0.061038073,0.46384075,0.14799853,0.3044674,0.0075844764,0.29227465,0.99835545,0.0007653463,0.0008791017
Lightfoot stressed her belief that the election of Joe Biden to the White House is key to securing these and other controls for Chicago and the rest of the country.,0,0.08502128,0.9931543,0.0060177846,0.00082797545,0.0011706057,0.9914732,0.007356207,0.035485,0.73644066,0.22807434,0.01017047,0.013554249,0.1361624,0.4552273,0.37002814,0.014857532,0.0006030699,0.0003500914,0.0005467573,0.9991032
Democrats effectively nationalized the student loan industry in 2010 by transferring eight million loans into the federal government’s hands.,0,0.21389396,0.99493045,0.0046530124,0.00041649287,0.74656665,0.24261822,0.0108151175,0.013093852,0.032109763,0.9547964,0.0095679,0.018536398,0.48879865,0.29034847,0.18556574,0.00718284,0.00025338115,0.3653117,0.03873083,0.59595746
"A sharp drop in temperatures and wind speed, combined with vehicle and industrial emissions, dust from building sites and smoke from garbage burning has boosted pollution over much of north India, including New Delhi, home to more than 20 million.",0,0.100233994,0.9968426,0.0023524396,0.000804981,0.68253803,0.31619355,0.0012684307,0.7208862,0.20814832,0.07096557,0.03350703,0.29891023,0.6492661,0.010311121,0.0044527566,0.0035527444,0.00073615945,0.9913155,0.006886427,0.0017980103
"As the United States women’s national team clinched their fourth World Cup title on Sunday, fans across New York City gathered at local watering holes and match parties, striking an optimistic tone about the future of the women’s game.",0,0.08378743,0.98716867,0.01239123,0.00044012308,0.4738685,0.5250032,0.0011283507,0.022386044,0.85050094,0.12711303,0.012177639,0.027387729,0.43108925,0.31396848,0.20710555,0.00827136,0.013449175,0.0004440011,0.00044326665,0.99911267
The White House said on Monday that President Donald Trump was not firing U.S. infectious disease expert Dr. Anthony Fauci despite his retweet of a supporter’s #FireFauci message.,0,0.087343715,0.997511,0.0019275933,0.00056140317,0.9995615,0.00038511562,5.3376178e-05,0.0018606508,0.0010389958,0.9971003,0.025283918,0.016865553,0.16755079,0.062982626,0.72217673,0.0051404177,0.0107315015,0.008728128,0.99022853,0.001043402
"The Federal Reserve, long criticized for being too white and male, crossed a substantial milestone last year: for the first time in its 107-year history, white men held fewer than half of board seats at the Fed’s 12 regional outposts.",0,0.0965238,0.9963135,0.0033298342,0.00035671034,0.9855354,0.0053073317,0.009157305,0.6799205,0.07735933,0.24272016,0.13898815,0.31784979,0.521703,0.010531291,0.00862585,0.0023018396,0.0014978716,0.99710065,0.0021006742,0.000798643
"White House National Economic Council Director Larry Kudlow said on Friday that he did not favor a higher federal tax on gasoline to fund an infrastructure program, but if states wanted to raise their own gas taxes, that was up to them.",0,0.060666695,0.9964845,0.0025466478,0.0009688688,0.81658894,0.18302825,0.00038282588,0.9939044,0.0031607805,0.0029347637,0.009793449,0.011863549,0.14750923,0.5048428,0.31289268,0.013098236,0.00026460466,0.0013737614,0.9971854,0.0014408062
A new report reveals that the 2017 GOP tax law was rife with monumental self-dealing by rich GOP lawmakers who have since benefited bigly.,1,0.9253577,0.023542307,0.9719588,0.0044988394,0.001711405,0.06177376,0.93651474,0.0017179975,0.007697008,0.9905849,0.012691445,0.07366341,0.84189713,0.046987575,0.020587945,0.004172475,0.0447818,0.99747795,0.0008694297,0.0016525441
"The same goes for Govs. Gavin Newsom, Andrew Cuomo, Jay Inslee, and every other Wuhan virus Karen issuing diktats from on high.",1,0.9407406,0.000658828,0.0048178644,0.9945233,0.00015098584,0.99968934,0.0001597182,0.0017029706,0.0027158658,0.9955812,0.00952031,0.012393674,0.10891291,0.59135365,0.2647897,0.013029743,0.3786885,0.78590494,0.21297742,0.00111759
"Today, the cumulative stress of Donald Trump’s escalating trade war is leading to if not an irreparable breach between America and China, then certainly a significant fraying.",1,0.913725,0.00051697483,0.014840315,0.9846428,0.0017545449,0.035982475,0.96226305,0.0013131627,0.0010310799,0.99765575,0.015208165,0.08427057,0.83978134,0.03467606,0.020443518,0.0056202747,0.068770885,0.9966227,0.0018810547,0.0014962525
"President Donald Trump personifies the impulse to ignore the peril while insisting on prejudice, rather than science.",1,0.9285235,0.0006190336,0.0075906366,0.9917903,0.00015511287,0.9991698,0.0006750879,0.00080475386,0.00121203,0.9979832,0.014498196,0.017341673,0.14671463,0.602241,0.1908125,0.028392002,0.030678933,0.99387866,0.0013301156,0.004791141
"Conspiracy theories about the Sandy Hook shooting have persisted for years, for example, far-right InfoWars host Alex Jones claimed that the whole thing was staged by the government with child actors and no kids were harmed ― which ultimately led to a lawsuit against him by parents of the victims.",0,0.26778975,0.992004,0.0077139875,0.00028200416,0.0019931023,0.96947485,0.028531995,0.0019888622,0.0009970273,0.99701405,0.099927165,0.090543516,0.7016433,0.03092576,0.06613445,0.0108258,0.101792,0.99662566,0.0031440048,0.00023040286
The Border Patrol has said Hernandez was pelting U.S. agents with rocks from the Mexican side of the Rio Grande when he was shot.,0,0.07893293,0.99733305,0.0019227011,0.00074428885,0.9707285,0.015178906,0.014092647,0.0047153183,0.96794885,0.027335789,0.35850388,0.20932756,0.2781805,0.020527521,0.11935116,0.014109418,0.00029739793,0.99439067,0.0051566046,0.0004527481
‘The most progressive president since FDR’: Biden's policy proposals reveal a pleasant surprise,0,0.6620053,0.0033580682,0.36785132,0.62879056,0.0030048417,0.0064616245,0.9905336,0.002233245,0.008619559,0.9891473,0.022507133,0.045237422,0.3507107,0.17582634,0.39856133,0.0071570403,0.1070103,0.0019472876,0.00078458927,0.9972681
"An investigative journalist whose exposés on the deep-rooted corruption in African soccer led to the downfall of a member of the high-powered FIFA Council was shot dead Wednesday, months after a Ghana politician called for retribution against him.",0,0.09308081,0.9965155,0.0030957125,0.00038867275,0.0004791019,0.9874945,0.012026371,0.031574193,0.778399,0.1900268,0.009189043,0.01167401,0.15135764,0.15967543,0.663106,0.00499785,0.00032064167,0.99697423,0.0017824053,0.001243374
Four major U.S. cities filed a lawsuit on Thursday contending that President Donald Trump’s administration is unconstitutionally seeking to undermine Obamacare by failing to faithfully execute the healthcare law.,0,0.078377455,0.9953798,0.0041386834,0.0004814898,0.99933904,0.00048380927,0.00017714796,0.0015270689,0.0014149867,0.9970579,0.011028927,0.0076320106,0.076073185,0.13674778,0.76158845,0.0069297366,0.0002654843,0.99824023,0.0008570543,0.0009027603
"Here's the first thing to notice about the horrific news cycle of the past few days: Donald Trump is openly stoking right-wing violence, in no small part, because it bumps the coronavirus pandemic (6 million cases and rising, more than 183,000 dead) and the economic crisis (10% unemployment and 29 million Americans going hungry) out of the headlines.",1,0.96253854,0.0066419374,0.96760625,0.025751881,0.0040661413,0.012214152,0.9837197,0.001428614,0.00079084147,0.9977805,0.018321298,0.024344532,0.23014165,0.49214467,0.19909732,0.035950538,0.11028587,0.9982332,0.0007835562,0.0009831677
"In Saudi Arabia, the government expanded its decision last week to ban foreigners from making the pilgrimage to Mecca and Medina – home of the holiest sites in Islam.",0,0.09674919,0.9974874,0.0020441178,0.00046851026,0.05701594,0.9386726,0.004311497,0.08539589,0.7119642,0.20263988,0.0252846,0.031071339,0.4084261,0.109691195,0.42165565,0.0038711748,0.00024615866,0.6913086,0.3052482,0.003443228
